intent,text
get_estimated_departure,Can I only get home by sundown if I exit the festival prematurely?
update_directions,"""Discover a different pathway to your workplace."""
get_estimated_duration,How much time will I be stuck in traffic?
get_info_traffic,How busy are the roads in Downtown Phoenix?
get_info_road_condition,"""Has the Champaign ave. ice been cleared yet?"""
get_directions,Could you guide me on the quickest route that would take me to Walmart from my present location?
get_info_road_condition,
get_info_traffic,Is it possible to drive along Highway 80 in Truckee or is it currently closed?
get_info_road_condition,Is it now safe to traverse Champaign Ave. or has the ice been cleared?
get_estimated_duration,Calculate the estimated time of arrival to Louveira's central district while taking Bandeirantes Highway.
get_info_road_condition,Have the roads surrounding the Watseka ball diamonds cleared of floodwater?
get_distance,"What is the distance between my place of residence and workplace, in miles?"
get_estimated_duration,What is the duration of the journey to reach the local supermarket?
get_estimated_duration,"""What is the duration of my journey to reach Beatrice"""
get_info_route,Are there any roads with tolls from Pennsylvania leading to Kentucky?
get_info_traffic,This morning's traffic is moving at a very sluggish pace.
get_distance,How far is it from Indianapolis to San Antonio?
get_estimated_departure,Can you suggest the most ideal timing to depart from work in order to reach Presidente Epitacio by 3 am?
get_estimated_duration,"""In consideration of the traffic conditions, what is the typical duration of travel from here to Vacaville?"""
get_info_road_condition,At what time is the expected snowfall on highway 90?
update_directions,"""How can I find a route that has minimal traffic leading to my house?"" "
get_estimated_arrival,At what point in time can I expect to be back in my own abode?
get_info_road_condition,Are there any instances of water overflowing in the area between here and Georgetown?
get_estimated_arrival,"Leaving by 1:30 pm, will I be able to reach my meeting in Waco at 3 pm?"
get_estimated_arrival,"Leaving my work, can I expect to be at home by 9 pm?"
get_directions,Can you suggest a speedy route from my present location to Walmart?
get_info_traffic,Have any mishaps occurred on I-55?
get_info_road_condition,What is the condition of the streets like for my journey to work today?
get_location,What's the closest interstate around here?
get_estimated_arrival,"If I depart now, is it possible to reach Detroit by noon?"
get_info_road_condition,Has Black Bear cleared the flood from last night?
get_estimated_duration,Can you tell me how much time it usually takes to go from Orlando to Destin?
get_estimated_arrival,"If I depart from my house at 8:00 am, what would be the time of my scheduled arrival in Myrtle Beach, South Carolina?"
get_info_road_condition,Has the snow been cleared from Interstate 57 yet?
update_directions,Could you please suggest an alternative route?
get_estimated_arrival,Is it possible for me to arrive at my meeting in Waco on time if I depart at 1:30 pm?
get_estimated_duration,What is the duration of the commute to reach the supermarket?
get_estimated_duration,Can you tell me how long it takes to commute from Tacoma to Seattle currently?
get_location,Which interstate is in the immediate vicinity?
get_info_traffic,Is it expected that the Cubs game taking place tonight will cause congestion in traffic around Wrigleyville?
get_directions,"""Can you suggest a recommended way to reach St Louis while bypassing any ongoing constructions on Poplar Street Bridge?"" "
get_info_traffic,Have there been any incidents on Route 85?
get_info_traffic,Could you provide an update on the traffic situation surrounding the Essence Music Festival in Los Angeles?
get_directions,Are there any routes to take that will allow me to avoid the ongoing construction on my way to Detroit this evening?
get_estimated_departure,At what time do I need to depart if I desire to arrive at OMSI in Portland by 2:30?
get_estimated_arrival,Is it possible for me to reach HNL airport within 15 minutes by taking the Nimitz route before 5 pm?
get_estimated_duration,What is the estimated time of travel from Brooklyn Bridge to New Jersey by car?
get_estimated_duration,Can you tell me the length of time required for a car journey from Detroit to Atlanta?
get_info_road_condition,Can you tell me if the 90 highway has any snow on it?
get_estimated_departure,"""Do I need to exit the festival ahead of time to arrive at my house by sunset?"""
get_directions,I am looking for guidance on how to reach the Fargodome starting from Hwy75 in Minnesota; may I request your assistance in providing me with directions?
get_directions,"""Can you suggest a route to get to downtown Atlanta that does not require passing through any roadwork or maintenance sites?"""
get_estimated_duration,Could you tell me the estimated time required to travel from my place to Beatrice?
get_estimated_duration,What is the estimated time of arrival for tonight's game?
get_estimated_arrival,
get_info_traffic,Do you know which pathways are inaccessible due to roadblocks?
get_directions,"""What is the optimal path to get to St Louis without encountering Poplar Street bridge construction?"" "
get_info_traffic,"""Can you suggest some routes that experience less traffic than others?"""
get_distance,What is the travel distance separating Seattle and Reykjavik?
get_estimated_duration,"If I depart at 1 pm, how much time will it take me to reach my 2 pm visit?"
get_directions,Can you suggest an alternate course of travel to get to the Cherokee Casino from my residence while bypassing HWY 321? 
get_estimated_arrival,"If I start right now, is it possible for me to reach Dallas before midnight?"
get_estimated_arrival,What time can I anticipate arriving at work if I take I-90 at 8:00 in the morning?
get_info_road_condition,
get_info_road_condition,Can you provide me information about the quality of roads for my traveling to office this morning?
get_estimated_duration,
get_info_traffic,Is it possible to verify whether there are any mishaps or collisions along the way from here to Chapin on I-26 West?
update_directions,Steer clear of the rush hour traffic.
get_estimated_duration,Can you provide me with an approximation of the time it will take for me to reach the other end of the city?
get_distance,Could you tell me how far apart are New York and Seattle in miles?
get_estimated_arrival,"If I leave now, is it possible for me to reach Dallas before midnight?"
get_directions,Can you provide me with the fastest driving route to International Drive in Orlando that avoids any road construction or delays?
get_distance,Can you tell me the number of miles between New York and Los Angeles?
get_estimated_arrival,When will I get there?
get_estimated_duration,Can you tell me how far San Francisco and Monterrey are from each other if I were to drive there?
get_info_traffic,Did any significant accidents take place within Boston's limits today?
update_directions,Could you provide me with alternative pathways that I can take to escape the congested roads?
get_estimated_departure,What is the required time of my departure to ensure I reach the airport before 9:00 am?
get_estimated_duration,How much time do I need to allocate for a journey from Orlando to Destin?
get_estimated_duration,Could you tell me how far it is from the shoe outlet to my residence?
get_distance,What is the distance in miles between New York and Los Angeles?
get_directions,Is there a transportation service available to take me from Banning to Palm Springs via bus?
get_location,What's the nearest Target location?
get_directions,Can you provide me with directions to the Atlanta aquarium that I can follow while driving?
get_estimated_duration,How much time does it take to commute to Destin from Orlando?
get_estimated_departure,"""If I want to arrive an hour early for the concert that starts at 7 pm, what time should I leave home?"""
get_directions,Can you suggest any bus services that operate from Banning to Palm Springs?
get_directions,"""What is the quickest way to reach Gainesville from Ocala?"""
get_estimated_duration,How long does one usually take during rush hour to get to the heart of the metropolis?
get_estimated_departure,"""If my doctor's session starts at 5 pm, when should I exit my workplace to ensure that I won't be late?"""
get_info_traffic,"""What are the roads with minimal traffic flow?"""
get_estimated_duration,"""Taking traffic into account, how long does it usually take to reach Vacaville from this location?"""
get_location,Can you suggest a nearby grocery store?
get_distance,What is the span from Orlando to Sanford?
update_directions,
get_info_road_condition,Are there any flood-proof locations on the stretch of road known as Route 202?
get_info_traffic,
get_directions,"What is the most efficient route to Cherokee Casino from my residence, circumventing HWY 321?"
get_directions,"I need to know how to get to Nashville, TN by car. Could you give me some driving directions?"
update_directions,Are there any alternative routes that experience less congestion as compared to 1st Avenue?
get_info_traffic,Can you recommend some low-traffic streets to take?
get_estimated_arrival,How long will it take me to arrive at my destination using this fresh course?
get_estimated_departure,At what time do I need to depart to arrive at work by 9 am?
get_estimated_duration,Can you state the time it takes to commute to the grocery store?
get_estimated_duration,How many minutes does it take for me to travel from my location to the supermarket?
get_estimated_arrival,"Leaving now, will I make it downtown by 7:30?"
get_estimated_duration,How much time should I allocate for traveling via car from Brooklyn Bridge to New Jersey?
get_estimated_departure,"""At what time do I need to vacate my workspace if I want to arrive at the medical facility before 5 pm?"""
get_distance,What is the distance between my home and workplace in terms of miles?
get_estimated_arrival,Can I reach home before 9 pm if I leave my workplace now? 
update_directions,Are there any means for me to quicken my pace?
get_estimated_arrival,Will reaching my Waco meeting on time be possible if I set out for it at 1:30 pm sharp?
get_info_road_condition,"""Are the roads covered in ice or snow?"""
get_directions,Can you suggest the fastest route to West Chester University on a Sunday night?
update_directions,Can you explain the concept of route redirection?
get_info_road_condition,Is it likely that I will encounter snow on my morning commute at 5 a.m.?
get_estimated_arrival,Can I make it to the HNL airport in less than 15 minutes if I take Nimitz and leave before 5 pm?
get_estimated_arrival,Can I arrive on Broadway in time for a 6 pm showing of Hamilton if I take the freeway route? 
get_info_road_condition,Is the road that runs adjacent to the soccer field still inundated with water?
get_info_road_condition,Are there areas along 202 that are equipped to handle a potential flood? 
get_estimated_arrival,"Could I make it to New York City by 9 pm this evening, starting from my residence?"
get_estimated_departure,When would I have to leave my house so that I could reach Bandelier Monument by 9am come Saturday morning?
get_info_route,Is there any petrol pump located between this place and my residence?
get_info_route,Do I pass by any petrol stops if I go through this path?
get_estimated_duration,What is the duration of my time spent in traffic?
get_distance,What's the mileage from home to your place of employment?
update_directions,Unearth another course to take on your way to the workplace.
update_directions,Please display various roadway options that circumvent heavy traffic.
update_directions,Is it possible to take a different pathway today so as to bypass the traffic?
get_directions,How can one reach the Concert Hall in Chicago using I - 494?
get_directions,"What is the easiest way to reach Ikoyi from Harvestrue, Building A by 2:44pm today?"
get_info_traffic,Can you describe the flow of vehicles around 5 pm?
get_directions,Are there any available transportation services from Banning to Palm Springs by bus?
get_directions,Are there any available bus schedules between Banning and Palm Springs?
get_info_road_condition,Was the flooding last night washed away by a Black Bear?
update_directions,Is there any other road that we can take to evade the traffic congestion today?
get_estimated_duration,Discover the duration to reach downtown Louveira via Bandeirantes Highway.
get_directions,"""How can I arrive at the U2 concert in the shortest amount of time?"""
get_distance,What is the distance between Phx and NY?
get_info_traffic,Would you happen to know if there's a lot of traffic congestion along the route from Wilshire to 3rd Street in Los Angeles?
get_estimated_duration,What is the estimated duration of travel from Maria's to the beach?
update_directions,"""What is the way to get home with less traffic?"" "
update_directions,I'm currently stuck in traffic. Do you know of any detours or shortcuts that can help me avoid it?
get_distance,What is the distance separating Louisville and Lexington?
get_estimated_arrival,What's the estimated arrival time in Myrtle Beach if I start my journey at 8:00 am from my home?
get_estimated_arrival,Is it probable that I will reach my workplace on schedule despite this congested traffic?
get_info_route,"""Could you provide me with a list of gas stations that fall between my present location and endpoint?"""
get_info_road_condition,What is the condition of the road like during my commute to the workplace today?
get_estimated_duration,What amount of time is required for me to reach Shreveport if I leave at this instant?
get_estimated_departure,What is the ideal time for me to leave so that I can reach the airport by 9:00 am?
get_estimated_departure,"To ensure attendance at the Jazz game commencing at 8 PM, what is the recommended time to leave?"
get_info_road_condition,Have the floodwaters receded on the roads surrounding the ball diamonds in Watseka?
get_info_road_condition,Will there be snow while traveling to my grandmother's house?
get_info_road_condition,"""Can I expect to find icy conditions on my street?"""
get_directions,Discover an alternate route that will lead you to the heart of Atlanta without encountering any ongoing construction work on the roads.
get_estimated_departure,What time should I depart if I want to arrive at the zoo when it opens on Saturday? 
get_estimated_arrival,Do I have a chance of making it to work on schedule amidst this traffic?
get_directions,What is the bus that goes to Long Beach?
get_estimated_duration,
get_info_route,"""Can you provide me with a list of gas stations that are on the way from where I am to my destination?"""
get_estimated_arrival,Is it possible for me to reach Billy's house by 8:30 am assuming I leave my residence at 8 in the morning?
get_info_traffic,Can you describe the traffic conditions presently?
get_distance,"""What is the travel distance between Seattle and Reykjavik?"""
get_estimated_duration,Can you tell me the duration it will take us to make it to the game tonight?
get_info_road_condition,Is there any presence of snow on the roads today?
get_estimated_arrival,When should I anticipate reaching the place I am aiming for?
get_directions,Can I find any bus schedules that go from Banning to Palm Springs?
get_info_route,Can you confirm whether or not there is a gas station on this particular route?
get_estimated_departure,When do I need to set out for the football game that commences at 5?
get_estimated_arrival,"""By taking this new route, what time can I expect to arrive at my final destination?"""
update_directions,Is there a more expedited approach to get work done?
get_distance,"""How far apart are Atlanta and Nashville in terms of miles?"""
get_distance,"How far apart are New York and Seattle, measured in miles?"
get_estimated_duration,Could you provide me with an estimate of the amount of time required to travel from here to the market?
get_estimated_duration,What is the amount of time required to arrive at the game tonight?
get_estimated_departure,What time should I depart from my residence to arrive at Bandelier Monument by 9 am on Saturday morning?
get_location,Where can I find the closest Six Flags theme park to my current location?
get_info_road_condition,Would it be likely for me to see any signs of snow along the road leading up to Mariposa during this weekend?
get_location,Which Six Flags theme park is the closest to my current location?
get_estimated_arrival,"By taking the freeway, am I able to reach Hamilton on Broadway by 6 pm?"
update_directions,Can you suggest different travel routes aside from the regular St. Cloud-Minneapolis path?
get_info_traffic,How bad is the congestion during 5 pm rush hour?
get_estimated_departure,At what hour do I have to leave to get to the airport for a 9:00 am flight?
get_distance,Can you tell me the approximate distance from New York to Boston?
get_info_traffic,What are the roads that have minimal traffic volume?
get_estimated_departure,At what time should I depart in order to arrive at the airport by 9:00 am?
get_estimated_arrival,Can I arrive at HNL Airport within 15 minutes of leaving before 5 pm via the Nimitz route?
get_directions,How can I get from McAllen to State Farm Arena?
get_location,Can you tell me if there's a nearby bus stop for my new office?
get_info_road_condition,"""Is there any presence of snow on the roads at present?"""
get_info_road_condition,"""Are the roads covered in snow today?"""
get_estimated_departure,When do I need to leave to get to Irvine by 7 pm?
get_location,Can you list down a few water parks located in Minneapolis?
get_info_road_condition,Does the road to Georgetown have any flooding?
update_directions,Do you know of any alternative paths that could lead me home faster?
get_estimated_departure,At what point should I vacate my house so as to arrive on schedule for the Bulls match tonight?
get_estimated_duration,What is the estimated time it would take to reach Trustco Bank on Madison Avenue in Albany from Union College by driving?
get_info_traffic,What are the roads that have been obstructed?
get_info_route,"""What are the gas stations located en-route from where I am now to my intended destination?"""
get_info_traffic,Is there any ongoing construction on 696 that I should be aware of if I plan to attend the homebuilder show in Novi?
get_estimated_duration,What is the estimated travel time for my friend leaving from La Jolla at 6?
get_directions,Can you provide me with directions on how to reach the Atlanta aquarium by car?
get_distance,Could you tell me the approximate driving distance from Houston to Vancouver?
get_estimated_duration,How much time do we need to reach the game venue for tonight's match?
get_distance,What is the distance between Alabama and Georgia by car?
get_distance,"""How long of a drive is it from Moab, UT to Provo, UT?"""
get_directions,"""What is the quickest method to reach the U2 gig?"""
get_distance,"""Can you tell me the gap from Miami to Orlando?"""
update_directions,Stay away from high volumes of vehicular movement.
get_distance,What is the mileage between Phoenix and Seattle?
update_directions,Is there a way to get home faster?
get_estimated_duration,"If my departure time is at 1 pm, what is the duration I must travel to get to my appointment by 2 pm?"
get_info_traffic,What is the level of congestion experienced by motorists driving through Downtown Phoenix?
get_directions,Can you suggest the most convenient path to get from Saint George to Las Vegas?
update_directions,Is there a different path that can be taken to avoid congestion today? 
get_estimated_departure,What is the ideal departure time to reach Mayfield for my 4 pm appointment?
get_info_traffic,Is the bottleneck close to its conclusion?
get_distance,How far is the workplace from here?
get_info_road_condition,Are we likely to encounter flooding on the way later this evening?
get_location,What is the location of Iolani Palace?
get_distance,"""What is the exact measurement of the distance from Seattle to Chicago?"""
get_distance,Could you tell me the approximate distance between here and El Paso?
update_directions,"""Is there a way to avoid heavy traffic while commuting back home?"""
get_estimated_departure,When should I leave to ensure I am at work no later than 9 o'clock?
get_estimated_departure,"If I want to attend the Jazz game that begins at 8 PM, what is the appropriate departure time? "
get_info_traffic,Are there currently any incidents of car crashes or collisions occurring on the 85th freeway?
update_directions,Modify the direction to steer clear of jammed roads.
get_estimated_departure,What's the ideal departure time for me to make it to OMSI in Portland before 2:30?
get_directions,Which road is the most favorable way to travel from Saint George to Las Vegas?
get_estimated_duration,I'm curious about the amount of time it would take to go from Chicago to Indianapolis. Could you let me know?
get_estimated_arrival,"""Do you have a prediction for my anticipated arrival time?"""
get_distance,Can you tell me the gap between Portland and Seattle?
get_info_road_condition,"""Has the snow storm caused poor road conditions that are still present this morning?"""
get_estimated_arrival,Is it possible that I will be running late for the 7 o'clock concert if I set off in 45 minutes?
update_directions,Can you present me with alternative routes that go around any congestion?
get_distance,Can you tell me how many miles it is from Phoenix to Seattle?
get_directions,Which path should I choose to arrive at Disney World on time and without having to pay for tolls or facing congested roads?
update_directions,Can you propose other ways to evade rush hour on 35 South?
update_directions,Can you suggest different paths that lead to 87th Avenue?
get_location,"""I am curious if there happens to be a bus stop near the location of my new office, do you know?"""
get_directions,Which route can I take for a quicker commute to my job?
get_distance,Can you tell me how much distance there is between San Diego and San Francisco?
update_directions,Is there a different route that you can recommend?
get_info_traffic,Does the homebuilder show in Novi coincide with any ongoing road works or constructions on 696?
get_estimated_departure,At what point should I start my commute to make it to work promptly?
get_estimated_arrival,Can you provide me with an estimate of my arrival time?
get_info_road_condition,Does snow cover the route of 243 when descending?
get_distance,Can you tell me the length of the route from Orlando going to Sanford?
get_estimated_arrival,How much longer till I reach my destination?
get_estimated_arrival,Can I reach my workplace on time amidst this traffic?
get_estimated_departure,"In order to be in New Jersey by 5 pm, when do I need to take the train?"
get_info_traffic,Are there any delays in traffic flow from Spruce to Pine Streets?
get_info_road_condition,Have the floodwaters subsided from the pathways surrounding the ballparks in Watseka?
get_estimated_departure,When should I begin my commute so that I arrive at the office before 7 o'clock in the morning?
get_estimated_departure,At what time do I need to leave my residence if I want to make it to Grand Blvd Movies at 7 pm?
get_directions,"""Can you suggest a toll-free path from this point to Tampa?"""
get_info_route,Look for an ATM that is on the way to Stephanie's office.
get_info_road_condition,Might my journey to work at 5 a.m. be impacted by snow?
get_distance,
get_info_road_condition,Is it icy on the road near my residence tonight?
get_info_traffic,What does the traffic look like around 5 pm?
get_info_route,Do tolls need to be paid on the turnpike?
get_location,"""I am wondering if there are any grocery stores nearby where I currently am."" "
get_info_road_condition,Have there been any notifications or warnings regarding the presence of black ice on the path towards the camping area early today?
update_directions,Could you seek out a different avenue?
get_estimated_arrival,"Assuming mom is leaving now, when can we anticipate her arrival at our residence coming from Blytheville?"
get_directions,"""Is there a faster way than usual to reach the U2 concert?"""
get_info_road_condition,Is there a possibility of snowfall during my 5 a.m. commute to work tomorrow?
get_distance,What is the distance between here and Chicago?
get_distance,Can you tell me how far it is from this location to Disney World in terms of miles?
get_info_road_condition,"""Are there icy conditions present on the way to Shelbys residence?"""
get_estimated_duration,How much time does it take to drive from San Francisco to Monterrey?
get_info_traffic,What is the volume of cars like at around 5 pm?
get_estimated_arrival,Will I reach home before 9 pm as I'm leaving work now?
get_estimated_departure,What is the ideal departure time for making it to the Dodger game by 5 pm?
get_estimated_departure,
get_info_route,Will I come across a fuel station while following this particular road?
get_info_route,Is it possible for you to inform me about the locations of every Shell petrol pump located along I - 59 between Hattiesburg and where we are now?
get_info_traffic,Can we expect traffic to slow down in Wrigleyville because of the Cubs game happening tonight?
get_estimated_departure,What would be the ideal time for me to leave if I need to reach OMSI in Portland by 2:30pm?
get_estimated_arrival,Is it possible for me to reach New York City from my residence before 9 pm today?
get_location,"""Could you kindly inform me whether there is a bus stop that's conveniently located near my newly assigned place of work?"""
update_directions,Modify the course to evade the traffic.
