intent,text
get_estimated_duration,What is the distance of my drive to Beatrice?
get_distance,How far apart are Houston and Hollywood?
get_info_road_condition,Was the flood of yesterday cleaned by a Black Bear?
update_directions,Can I possibly increase my speed somehow?
get_estimated_departure,What's the ideal departure time for me to reach the Thunder game before 6 p.m.? 
get_estimated_departure,When do I need to leave my home to be on time for the 8 pm screening?
get_distance,What is the distance in miles between this place and Disney World?
get_estimated_duration,Find out when Walmart starts its business day while traveling on Jabaquara Street.
get_estimated_departure,At what time should I depart in order to arrive in Irvine by 7 pm? 
update_directions,Is it possible to change the course?
get_info_route,Is there a gas station on the way if I take this route?
get_estimated_duration,What's the travel time by car from San Francisco to Monterrey?
get_estimated_duration,Can you tell me approximately how long it would take to drive from Union College to Trustco Bank on Madison Avenue in Albany?
get_directions,"What would be the directions to follow if I want to reach Ikoyi by 2:44 pm today from Harvestrue, Building A?"
get_info_road_condition,Has the highway between my domicile and office experienced any flooding lately?
get_estimated_duration,"If my friend departs from La Jolla at 6, what will be the duration of her journey to reach here?"
get_location,Where is the nearest Target outlet located?
get_estimated_arrival,"If I depart from Syracuse to New York City, what would be my estimated time of arrival?"
get_estimated_arrival,What hour should I aim to arrive at my house if I leave work at 4 o'clock today?
get_info_road_condition,"""Is there any presence of ice on the road that leads to my residence?"""
get_directions,"What route should I take if I were to drive to Nashville, TN?"
get_estimated_duration,What is the current estimated time of arrival when driving from Tacoma to Seattle?
update_directions,What are some alternate routes to take when commuting from St. Cloud to Minneapolis?
get_directions,Can you provide the fastest driving route to International Drive in Orlando with no detours or traffic?
get_info_traffic,How heavy is the traffic flow on the 10 highway?
get_estimated_duration,How much time should one allocate for traveling from Maria's residence to the beach?
get_estimated_duration,"Taking into account traffic, what is the duration of the journey to Vacaville from this spot?"
get_estimated_arrival,When can I expect you to reach my home?
get_info_route,Can you tell me which gas stations lie on my route from my current location to the destination?
get_estimated_duration,How long does it typically take to get from Chicago to Indianapolis by transportation means?
get_info_road_condition,Will the road to Mariposa have any snow during this upcoming weekend?
get_location,"""Would you consider Brian's residence to be situated nearby the H1 Freeway?"""
get_info_road_condition,Are the roadways covered in ice?
get_location,Can you tell me the closest Target store?
get_estimated_departure,Could you suggest the appropriate leaving time if my destination is OMSI in Portland and I must arrive there by 2:30 pm?
get_distance,"""How far apart are Miami and Orlando?"""
get_estimated_arrival,Is it feasible to get to downtown by 7:30 if I leave now?
get_info_road_condition,Does the freeway that links my abode and office have any flooding occurrences at present?
get_estimated_departure,"""What is the ideal departure time for me to reach the cinema before 8 pm, starting from my house?"""
get_distance,How many miles are there from Phx to NY?
get_estimated_duration,What is the estimated travel time for reaching downtown during peak hours?
get_info_traffic,Has the highway 80 in Truckee been cleared for driving?
get_info_road_condition,Is there a possibility that the streets will be submerged in water tonight?
get_estimated_duration,How long does it generally take to travel from New York City to Philadelphia?
get_estimated_arrival,What is the predicted time for reaching my destination?
get_info_road_condition,Is there any water overflowing between here and Georgetown?
get_directions,"Leaving by 1 PM, I require guidance to reach Katie's place located in Robertsdale."
get_info_road_condition,Has the freeway that leads to my residence been affected by floodwaters?
get_estimated_arrival,Is there a chance that I can make it to downtown by 7:30 if I go now?
get_info_road_condition,When can I expect to witness a snowfall on highway 90?
get_info_traffic,Would you be able to inform me if any accidents happened on I-26 West between this place and Chapin?
get_estimated_arrival,"Leaving in 45 minutes, is it probable that I'll miss the 7 pm concert?"
get_distance,What is the distance between New York and Boston?
get_info_traffic,Is I-55 experiencing any accidents?
get_distance,How many miles away is the Wine and Food Festival in Orlando?
get_estimated_duration,How much travel time can I expect if I depart for Shreveport presently?
get_estimated_departure,What is the right time for me to embark on my journey towards Cairo festival so as to get there at exactly 9 PM?
get_info_traffic,How congested is the traffic on I-10?
get_estimated_duration,How many hours of travelling are required to get to Destin from Orlando?
get_estimated_duration,How much time should I allocate for driving from Tacoma to Seattle?
get_estimated_duration,What is the estimated driving time from Miami to Key West?
get_info_traffic,Which routes have been barred?
update_directions,Is there a detour that I can take to avoid the traffic from where I am currently located?
get_location,"""Does Brian reside near the H1 Freeway?"""
update_directions,Can you suggest alternate pathways that have minimal traffic?
update_directions,Could you suggest an alternate route that has lighter traffic?
get_info_road_condition,"""Is it possible that the route to my grandma's place will have snow accumulation?"""
get_estimated_arrival,"Assuming I take the I - 90 route at 8 am, when can I expect to arrive at work?"
get_distance,"""Can you tell me the length of the journey between Seattle and Chicago?"""
get_estimated_arrival,Would it be possible for me to arrive at work on time given this traffic?
get_directions,"""I need help finding a fast and efficient way to get to International Drive in Orlando without experiencing any detours or traffic jams, can you assist me with providing accurate driving directions?"""
get_estimated_duration,"""How much time do I need to commute to my job?"""
get_distance,"What is the distance between Moab, UT and Provo, UT?"
get_estimated_duration,Could you tell me the duration of the flight from Orlando to Louisville?
get_distance,How far apart are Alabama and Georgia when traveling by car?
get_directions,"""Which path guarantees the quickest ride to West Chester University on Sunday nights?"""
get_estimated_duration,Can you give me an approximation of the time it would take me to travel across town?
get_estimated_arrival,Is there any possibility of me getting late if I leave at 8 in the morning for reaching Kearney by 11?
get_info_road_condition,"""Does my street have icy conditions?"""
update_directions,"""Are there any alternate routes available that I haven't yet considered to avoid congestion during my commute?"""
get_estimated_arrival,At what time will I reach my workplace by taking I-90 at 8 am?
update_directions,Can you provide me with a different path to reach our destination?
get_estimated_departure,Is it necessary for me to depart the festival early to reach home before sunset?
get_info_route,Locate an ATM en route to Stephanie's office.
get_info_traffic,"""Can you tell me if there is a lot of traffic on the highway 10?"""
get_estimated_arrival,"If I depart at 8 am, will there be a delay in arriving at Kearney before 11? "
get_directions,"""Can you recommend the most secure way for me to reach San Antonio Airport early morning tomorrow?"""
update_directions,Is it possible for you to demonstrate an array of detours to bypass any potential roadblocks?
get_estimated_departure,At what time should I depart in the morning to avoid traffic and arrive at work by 8 AM?
get_estimated_departure,When do I need to leave this location to arrive at the nearest cinema around 8:00 pm?
get_distance,How far is the distance between Orlando and Sanford?
get_directions,Could you guide me on how to reach the Walmart store that is close to downtown?
get_estimated_departure,What is the departure time from work required to arrive at Taylor's residence by 10 pm?
get_info_route,Is the turnpike a route that requires payment of tolls?
get_estimated_departure,At what hour should I vacate my workplace so that I can arrive at the physician's establishment before 5 pm?
get_distance,How far apart are New York and Los Angeles?
get_estimated_departure,"To get to the Grand Blvd Movies by 7 pm, when do I need to start my journey from my residence?"
get_info_road_condition,
get_info_traffic,Has there been any occurrence of incidents on I-55?
get_estimated_duration,What's the estimated period for me to be delayed by the traffic?
get_estimated_duration,Calculate your estimated arrival time to Walmart by taking Jabaquara Street route.
get_directions,"""Can you suggest a safe and reliable route to follow when heading to the San Antonio Airport tomorrow morning?"""
get_info_traffic,How's the current traffic situation?
get_directions,Is there a route that I can take to arrive at the mall?
get_info_traffic,How heavy is the traffic flow in San Diego at the moment?
get_directions,"""What is the quickest route to get to the U2 concert?"""
get_estimated_duration,"""What's the approximate travel time to Atlanta considering the ongoing construction on I-95?"""
get_estimated_duration,What is the estimated time of arrival for a flight departing from Orlando and arriving in Louisville?
get_info_traffic,What is the present state of traffic in San Diego?
get_distance,What's the geographical span between New York and Boston?
get_location,What's the nearest Six Flags theme park and where can I find it?
get_directions,Can you tell me the location of the closest exit with minimal traffic?
get_directions,What is the quickest way to get from Ocala to Gainesville?
get_info_road_condition,Is there still any flooding on the roads around the ball diamonds in Watseka?
get_estimated_duration,What's the estimated duration of travelling to the game tonight?
get_estimated_duration,What is the estimated time for me to reach the other side of the city?
get_estimated_departure,Could you advise me on the exact departure hour to target as a means to get to the theater by 8 pm?
get_distance,What is the gap between Miami and Orlando?
get_estimated_arrival,"If we leave now, at what time can we expect to arrive in Arkansas?"
get_estimated_arrival,Is it possible for me to arrive at Billy's house by 8:30 am if I depart from my house at 8 am?
update_directions,"I am looking for a way that will get me to the theatre faster, any ideas?"
get_distance,How long does it take to get to the Wine and Food Festival in Orlando?
get_distance,How many miles away is El Paso?
get_distance,"""What is the number of miles separating Atlanta and Nashville?"""
get_estimated_departure,When do I need to leave in order to get to work?
get_estimated_departure,What is the departure time that will get me to Irvine by 7 pm?
get_distance,"""Can you provide the measurement of the space from Chicago to Peoria in Illinois?"""
get_directions,Could you tell me which exit is the closest with minimal traffic flow?
get_estimated_arrival,What is the estimated time of my arrival?
get_info_traffic,Does traffic during peak hours seem worse than usual?
get_estimated_arrival,Would I be able to arrive at Billy's residence by half past eight if I depart from my home at 8 o'clock in the morning?
get_info_road_condition,Has the flooding on the street beside the football stadium subsided?
get_estimated_departure,What is the departure time necessary for me to reach the Atlanta airport by 6:30 am?
get_estimated_duration,Can you tell me the estimated time needed for me to get to the grocery store?
get_estimated_arrival,At what point will we reach Arkansas if we set off right away?
get_directions,"""Is it possible to obtain directions to downtown Atlanta while avoiding any construction zones along the way?"" "
get_estimated_duration,Calculate the time needed to arrive at Louveira's city center by taking the Bandeirantes Highway.
get_distance,What is the distance separating Portland and Seattle?
get_info_traffic,"I need to see the jams in vehicular movement around me, can you show that?"
get_info_road_condition,How are the road conditions along my route to work this morning?
get_distance,Can you tell me how far away Disney World is in terms of miles from here?
get_estimated_duration,
get_estimated_arrival,"If I depart via Nimitz before 5 pm, can I reach HNL airport in 15 minutes or less?"
get_info_traffic,"""Are there many cars on the road during this particular time?"""
get_info_traffic,"If I take the 696 route to get to the homebuilder show in Novi, will I encounter any constructions along the way?"
get_directions,Could you provide me with the route to reach Ikoyi from Building A at 2:44 PM today via Harvestrue?
get_info_traffic,Have there been any reports of accidents taking place on Route 85?
get_info_traffic,"Can you provide me with the present traffic situation in Foley, AL?"
get_distance,How many miles separate Los Angeles from New York? 
get_estimated_arrival,"""Can you provide me with an approximate arrival time?"""
get_info_road_condition,Are there any instances of water logging on the expressway en route from my residence to workplace?
get_estimated_duration,"If I plan to travel by car, what's the time it would take to reach Monterrey from San Francisco?"
get_estimated_duration,Find out the duration required for transportation via Bandeirantes Highway to get to downtown Louveira.
get_distance,What is the approximate distance from Boston to New York?
get_distance,"Is El Paso near or far away from here, and if so, how much distance should one expect to cover?"
get_info_traffic,Have there been any significant mishaps in Boston today?
update_directions,"""Could you propose a more time-efficient technique to work?"""
get_estimated_departure,What is the ideal time to depart from work for reaching Presidente Epitacio by 3 o'clock in the morning?
get_info_traffic,Is the traffic flow heavy or light on the LI Expressway currently?
get_estimated_departure,
get_estimated_duration,What is the distance from my home to the grocery store?
get_estimated_duration,
update_directions,Can we find a way to bypass this heavy traffic?
get_estimated_duration,I have recently arrived in Miami; do you know how much time it will take to reach Key West by car?
get_estimated_duration,"Upon reaching Miami, how long does it take to drive to Key West?"
get_info_traffic,What's the current status of traffic on I-10?
get_info_road_condition,
get_info_traffic,Can you tell me the current status of traffic in San Diego?
get_estimated_arrival,At what point in time will I reach my intended place? 
get_estimated_duration,What is the present duration of travel from Tacoma to Seattle?
get_info_route,Discover an ATM that lies en route to Stephanie's workplace 
get_info_route,"Between my abode and here, is there any fuel stop that can be found?"
get_distance,Can you tell me the proximity of the Wine and Food Festival in Orlando?
get_distance,What is the mileage between San Antonio and Houston?
get_distance,"""What is the gap between Phx and NY?"" "
get_distance,Can you tell me the number of miles from my residence to office?
get_estimated_arrival,"When would I reach Myrtle Beach, South Carolina if I depart from my house at 8:00 am?"
get_estimated_arrival,
get_estimated_duration,"If I depart now, what will be the duration of my travel to Shreveport?"
get_directions,Is it possible to travel by bus between Banning and Palm Springs on established routes?
get_info_traffic,How heavy or light is the traffic flow on I-84?
get_info_road_condition,How can the weather impact my daily travel?
get_info_route,Can you tell me where gas stations are situated along my journey?
get_estimated_arrival,When can we anticipate being in Arkansas if we leave from here?
get_info_traffic,How dense was the traffic on 217 throughout the day?
get_estimated_duration,"Assuming I commence my journey right away, how much time will it consume to reach Shreveport?"
get_location,Where can I find the closest alternative route exit?
get_estimated_duration,"""What is the travel time to downtown Louveira via Bandeirantes Highway?"""
get_info_road_condition,Are there any indications of ice on the roads this evening? 
update_directions,Can you suggest different pathways to bypass the congestion on 35 South?
get_info_road_condition,Do floods occur in the stretch of the freeway that connects my place of living and employment?
get_estimated_duration,Can you tell me the duration of a car trip from San Francisco to Monterrey?
get_info_road_condition,Are there any indications of black ice on the way to the campground based on reports this morning?
get_info_road_condition,Might there be a chance of road flooding this evening?
get_estimated_departure,When is the best moment for me to exit my home and reach the Bulls game tonight?
get_info_traffic,How bad is the rush hour today?
update_directions,Can you recommend some alternative ways to circumvent the heavy traffic?
get_distance,How far apart are Orlando and Sanford?
get_estimated_arrival,"Given the roadwork happening on I-90, leaving by 8:15 AM tomorrow, can I make it in time for my flight scheduled for 9 AM?"
get_estimated_arrival,What will be the time of my arrival?
get_estimated_duration,Please provide me with an estimate regarding the amount of time it would take me to reach Orlando if I use the 40 pathway.
update_directions,I request you to modify my current route while taking into account traffic congestions.
get_distance,"In terms of miles, how distant is New York from Los Angeles?"
get_info_traffic,"If I use 696, will there be any construction that may impede my journey to the homebuilder show in Novi?"
get_estimated_arrival,"Suppose I depart from Syracuse to New York City, what would be my estimated arrival time?"
update_directions,Can you suggest an alternative path for me to take in order to bypass traffic on my commute back home?
get_location,Which is the most nearby exit on a secondary road?
get_info_traffic,Can you tell me if there are any roadworks happening on I-696 which might affect my journey to the Novi home building show?
get_distance,What is the distance to the Wine and Food Festival in Orlando?
get_info_traffic,Is the current rush hour causing inconvenience for commuters?
get_info_road_condition,Is there still any flooding on the roads around the ball diamonds in Watseka?
update_directions,Can you suggest a quicker way to reach Phoenix Avenue?
update_directions,Could you show me some alternate routes that can help me avoid any traffic jams?
update_directions,"""Could you recommend a different way to go that isn't as crowded with vehicles?"""
get_info_route,Could you provide information regarding the availability of gas stations on my planned route?
get_distance,Can you tell me how many miles there are between New York and Seattle?
get_estimated_departure,"If I aim to be in New Jersey at 5, what is the appropriate time to board a train?"
get_estimated_duration,"Assuming I set off immediately, how much time will it take for me to get to the zoo?"
get_estimated_duration,Can you tell me how long it would take to drive from Miami to Key West?
get_info_route,Do motorists need to pay a toll fee when traveling on the turnpike?
get_distance,"""What is the mileage distance between Atlanta and Nashville?"""
get_info_road_condition,Is it possible that there might be inundation on the freeway stretching from my home to job location?
get_info_traffic,"""There appears to be a high volume of traffic presently."""
get_estimated_departure,At what time do I have to leave my house if I want to get to Bandelier Monument by 9 o'clock in the morning on Saturday?
get_estimated_duration,I'm wondering about the length of the drive from the shoe store to my home.
get_info_traffic,"""Are the roads congested on Route 10?"""
get_info_traffic,Can we expect any traffic disruption in Wrigleyville due to the Cubs game this evening?
get_estimated_duration,Utilize Jabaquara Street to determine the travel time to Walmart.
get_info_route,I would like to know the names of all the Shell fueling facilities that fall along the stretch of I-59 between our current location and Hattiesburg.
get_estimated_arrival,"Assuming I leave here at 8 am, what's the estimated arrival time in Miami?"
get_estimated_departure,
get_info_road_condition,Is there flood coverage in the 202 area?
get_estimated_arrival,Is it feasible to make it to Dallas before midnight if I depart from here at this moment?
get_estimated_departure,What is the ideal time for me to leave so I can arrive at the Dodger game by 5 pm?
get_estimated_arrival,"""When will I get there?"""
get_info_road_condition,"""Are there any instances of flooding along the freeway leading to my house?"""
get_info_road_condition,Can one access Ellen's house without facing any hindrances on the route?
get_estimated_arrival,"""When will my house receive the package?"""
get_info_traffic,Does the traffic flow smoothly between Spruce and Pine Streets?
get_estimated_arrival,Is it possible for me to arrive at the HNL airport within 15 minutes if I depart before 5 pm through Nimitz?
get_info_route,Is there a fee for using the turnpike?
get_estimated_arrival,"I intend to take I - 90 at 8 am, so what would be the estimated arrival time at my place of work?"
get_info_road_condition,Are the roads within close proximity to my dwelling slippery due to icy conditions this evening?
get_estimated_arrival,What is your estimated time of arrival to my residence?
get_location,Which water parks can be found in Minneapolis?
get_info_road_condition,Has anyone seen any reports about black ice on the road leading to the campground this morning?
get_estimated_arrival,"Leaving in 45 minutes, is it possible for me to arrive late for the 7 o'clock concert?"
update_directions,Can we find a way to bypass this congested traffic?
get_estimated_departure,What is the recommended departure time to ensure arrival at the Dodger game by 5 pm?
update_directions,"How can I express ""reroute"" in different words?"
get_directions,What would be the way to reach the shopping mall?
update_directions,Are there any alternate routes that can lead to a shorter travel time while going back home?
update_directions,Can you recommend a quicker path to reach Phoenix Avenue?
get_estimated_arrival,Can you tell me the estimated arrival time at my residence if I take this new route?
get_location,Can you tell me where the nearest on ramp is located?
get_directions,Can you tell me the bus that goes to Long Beach?
get_location,"From your knowledge, where can I find Iolani Palace situated?"
get_estimated_arrival,"""If I choose to use this unfamiliar way of commuting, what will be the approximate time of my arrival at home?"""
get_directions,"Can you provide me with the route to reach Ikoyi from Harvestrue, Building A today at 2:44 pm?"
update_directions,Can you suggest a road with comparatively less traffic than 1st avenue?
get_info_road_condition,Has anyone reported the presence of black ice on the way to the campground this morning?
get_estimated_arrival,At what point in time will we reach Arkansas if we depart presently?
get_info_traffic,"""What's the current state of traffic flow on Highway 202?"""
get_estimated_departure,When do I need to head out to get to the Dodger game at 5 pm?
get_directions,Provide instructions to the Concert Hall in Chicago through I - 494.
get_estimated_departure,When do I need to depart to make it to my nephew's game by 5 o'clock?
get_distance,Can you tell me the mileage between Los Angeles and New York?
get_estimated_arrival,What time would I arrive in Miami if I depart at 8 am?
get_estimated_duration,What amount of time should I allot for driving to Lake Wales?
get_info_road_condition,Is there any accumulation of snow on the 90 freeway?
get_directions,Which routes should I steer clear of in order to bypass heavy traffic while driving?
get_distance,What is the geographical span between the states of Florida and California?
get_info_road_condition,Does the weather have the potential to disrupt my commuting schedule?
get_location,Can you tell me where I can find Iolani Palace?
get_estimated_departure,When do I need to leave this place to make it on time to the nearest movie house by 8:00 p.m.?
get_info_road_condition,"""Is there any ice on the roads in my neighborhood tonight?"""
update_directions,How can I escape from getting stuck in this traffic?
get_estimated_departure,At what time should I depart in order to arrive at the airport by 9:00 am?
update_directions,Are there any faster ways to achieve the goal? 
get_estimated_arrival,Can you provide me with an estimate of my arrival time?
get_estimated_duration,What is the length of the journey when driving from Detroit to Atlanta?
get_info_traffic,Is there any blockage on the exits of Highway 50 currently due to roadwork?
get_distance,"""Can you tell me the length of the gap between my abode and Tacoma Dome?"""
get_info_traffic,Would the game of the Chicago Cubs tonight affect the traffic in Wrigleyville?
get_estimated_departure,Is there a recommended time for me to commute from work so that I can arrive at Presidente Epitacio by 3 am?
get_distance,How long does it take to travel by car between Houston and Vancouver?
