intent,text
atis_abbreviation,How do you define 73s?
atis_abbreviation,Can you provide information about 73s? 
atis_abbreviation,Why is 73s known as such?
atis_abbreviation,Can you shed some light on the significance of 73s?
atis_abbreviation,Provide information about 73s without using the mentioned words.
atis_abbreviation,Describe the essence of 73s in a different manner.
atis_abbreviation,"Can you provide information about the letter ""M""? "
atis_abbreviation,"Tell me what ""M"" is used for? "
atis_abbreviation,"I'd like to know the significance of the letter ""M""."
atis_abbreviation,Could you provide some information about the letter M?
atis_abbreviation,In what context can one use the letter M?
atis_abbreviation,How can M be described without using its actual name?
atis_abbreviation,Can you tell me the significance of fare code H?
atis_abbreviation,What is indicated by fare code H?
atis_abbreviation,What does fare code H signify?
atis_abbreviation,Can you provide information about fare code h?
atis_abbreviation,What's the signification of fare code h?
atis_abbreviation,Could you tell me what fare code h denotes?
atis_abbreviation,Can you provide some information on TPA?
atis_abbreviation,Tell me about the nature of TPA.
atis_abbreviation,What can you share regarding TPA?
atis_abbreviation,Can you provide information about TPA? 
atis_abbreviation,Define the acronym TPA for me.
atis_abbreviation,Give me insight into the nature of TPA.
atis_abbreviation,Could you shed light on the significance of fare code bn?
atis_abbreviation,Provide details about the implication of fare code bn.
atis_abbreviation,Let me know the interpretation of fare code bn.
atis_abbreviation,What is the significance of fare code bn?
atis_abbreviation,Could you shed some light on the fare code bn situation?
atis_abbreviation,How does fare code bn function?
atis_abbreviation,What is the significance of AP 20?
atis_abbreviation,AP 20 - what's its interpretation?
atis_abbreviation,Can you shed light on the connotation of AP 20?
atis_abbreviation,What is the significance of ap 20?
atis_abbreviation,Could you shed light on ap 20?
atis_abbreviation,In relation to what topic or context does ap 20 pertain?
atis_abbreviation,Can you shed some light on the definition of q?
atis_abbreviation,What is the implication behind the letter q?
atis_abbreviation,How can you characterize the concept denoted by q?
atis_abbreviation,What is the definition of the letter Q?
atis_abbreviation,Can you provide information regarding Q's significance?
atis_abbreviation,How would you describe the letter Q?
atis_abbreviation,Could you tell me which category does fare code q belong to?
atis_abbreviation,What type of ticket is associated with fare code q?
atis_abbreviation,Which class includes the fare code q?
atis_abbreviation,Identify the category of fare code q.
atis_abbreviation,In which group does fare code q belong?
atis_abbreviation,Categorize fare code q into its respective class.
atis_abbreviation,Can you provide some information regarding fare code bh?
atis_abbreviation,How would you describe the significance of fare code bh?
atis_abbreviation,Could you shed light on fare code bh?
atis_abbreviation,Could you shed some light on the significance of bh in the fare code?
atis_abbreviation,Kindly provide insight into the interpretation of fare code bh.
atis_abbreviation,Can you give me an idea about the implication of bh in the fare code?
atis_abbreviation,Can you provide information about cvg? 
atis_abbreviation,I'd like to learn more about cvg. 
atis_abbreviation,Could you share some knowledge on the topic of cvg?
atis_abbreviation,Define the acronym CVG.
atis_abbreviation,Could you provide a description of CVG?
atis_abbreviation,In what context would the term CVG be used?
atis_abbreviation,What is the definition of ua?
atis_abbreviation,Could you enlighten me about the meaning of ua?
atis_abbreviation,How would you describe ua?
atis_abbreviation,Could you provide some insights about the abbreviation UA?
atis_abbreviation,May I know the definition of UA?
atis_abbreviation,What is implied by the letters UA?
atis_abbreviation,Can you give me a description of d9s?
atis_abbreviation,"What do people refer to when they say ""d9s""?"
atis_abbreviation,Could you provide some information about d9s?
atis_abbreviation,Provide a definition for d9s.
atis_abbreviation,Define the term d9s.
atis_abbreviation,Can you shed some light on what d9s is?
atis_abbreviation,Could you provide information regarding the significance of fare code f?
atis_abbreviation,Please shed some light on the interpretation of fare code f.
atis_abbreviation,Can you outline the relevance of fare code f?
atis_abbreviation,Could you shed some light on the significance of the fare code F?
atis_abbreviation,What is implied by the fare code F?
atis_abbreviation,In what way does the fare code F differ from other codes?
atis_abbreviation,Could you provide information on the meal code sb?
atis_abbreviation,"I am unfamiliar with the meal code sb, can you shed some light?"
atis_abbreviation,What details are there to know about meal code sb?
atis_abbreviation,Could you provide information about the sb meal code?
atis_abbreviation,Please enlighten me on the sb meal code.
atis_abbreviation,I'm curious to learn more about the meal code denoted by sb.
atis_abbreviation,What information can be derived from fare code y?
atis_abbreviation,How is fare code y significant in the flight industry?
atis_abbreviation,In what way does fare code y impact airline ticket prices?
atis_abbreviation,Can you provide details regarding the y fare code?
atis_abbreviation,What makes the y fare code distinct from others?
atis_abbreviation,How would you characterize the y fare code?
atis_abbreviation,"Can you provide information on the fare code labeled as ""m""?"
atis_abbreviation,"How is the ""m"" fare code categorized in the system?"
atis_abbreviation,"What does the letter ""m"" signify within the fare code?"
atis_abbreviation,Can you provide information about the fare code M?
atis_abbreviation,Please enlighten me on the significance of the fare code M.
atis_abbreviation,What details do I need to know regarding fare code M?
atis_abbreviation,Can you provide information regarding fare code f?
atis_abbreviation,How would you describe the characteristics of fare code f?
atis_abbreviation,In what way is fare code f different from other fare codes?
atis_abbreviation,Can you provide information about fare code f?
atis_abbreviation,How can one recognize fare code f?
atis_abbreviation,What features are associated with fare code f?
atis_abbreviation,Can you define the limitations of ap58?
atis_abbreviation,Clarify the interpretation behind ap58.
atis_abbreviation,What are the implications of ap58 restrictions?
atis_abbreviation,What is the significance of the restriction ap58?
atis_abbreviation,In what way does ap58 constrain certain actions?
atis_abbreviation,How does ap58 affect a given context?
atis_abbreviation,Can you tell me the significance of AP 57?
atis_abbreviation,"I'd like to learn more about AP 57, could you provide me with some information on it?"
atis_abbreviation,What can you share about the definition of AP 57?
atis_abbreviation,Provide information regarding ap 57.
atis_abbreviation,Inquire about the significance of ap 57.
atis_abbreviation,Can you shed light on the interpretation of ap 57?
atis_abbreviation,Provide the full form of 'US'.
atis_abbreviation,Elucidate the abbreviated version of the term 'US'.
atis_abbreviation,Clarify the meaning of the acronym 'US'.
atis_abbreviation,What is implied by the letters US?
atis_abbreviation,Could you provide the interpretation of US?
atis_abbreviation,Which term do you associate with the shortened form US?
atis_abbreviation,Can you shed some light on the nature of phl?
atis_abbreviation,How would you describe phl in a nutshell?
atis_abbreviation,Could you provide some insights about phl?
atis_abbreviation,What does the acronym PHL signify?
atis_abbreviation,Can you tell me about PHL in brief?
atis_abbreviation,Could you provide some information on PHL?
atis_abbreviation,Can you give me information regarding the significance of fare code qo?
atis_abbreviation,How can I understand fare code qo?
atis_abbreviation,Please provide details about fare code qo.
atis_abbreviation,Provide information on the significance of fare code qo?
atis_abbreviation,Enlighten me about fare code qo.
atis_abbreviation,Identify the implication of fare code qo.
atis_abbreviation,"What's the signficance of ""sa"" in its negative form?"
atis_abbreviation,"Can you shed light on ""sa"" and what it doesn't represent?"
atis_abbreviation,"How is ""sa"" different from other abbreviations?"
atis_abbreviation,"Can you give some clarity on the significance of ""sa"" in this context?"
atis_abbreviation,"I'd like to comprehend the intended message conveyed without ""sa""."
atis_abbreviation,"Could you shed some light on what is being conveyed, minus the inclusion of ""sa""?"
atis_abbreviation,Can you shed light on the limitations of ap 57?
atis_abbreviation,How does ap 57 limit operations?
atis_abbreviation,Which actions are barred by restrictions imposed through ap 57?
atis_abbreviation,Elaborate on the limitations of ap 57.
atis_abbreviation,What type of constraints does ap 57 impose?
atis_abbreviation,Can you describe the boundaries set by ap 57?
atis_abbreviation,Can you provide some information about MCI? 
atis_abbreviation,How would you describe the nature of MCI?
atis_abbreviation,Could you enlighten me on the concept of MCI?
atis_abbreviation,Define the concept of MCI.
atis_abbreviation,Provide information on the nature of MCI.
atis_abbreviation,Elucidate the meaning behind the term MCI.
atis_abbreviation,Can you tell me the full form of hp?
atis_abbreviation,What is the expansion of hp abbreviation?
atis_abbreviation,Give me the meaning behind the term hp.
atis_abbreviation,What is the definition of hp?
atis_abbreviation,"For what does the abbreviation ""hp"" represent?"
atis_abbreviation,The term hp refers to which specific words?
atis_aircraft,"""Give me information on the M80 aircraft model."""
atis_aircraft,"""Inform me regarding the M80 air vehicle category."""
atis_aircraft,"""What can you tell me about the M80 aviation type?"""
atis_aircraft,Can you share some information about the m80 model?
atis_aircraft,Describe the features of the m80 category.
atis_aircraft,What do you know about the m80 type of aerial vehicle?
atis_aircraft,What are the different types of flying machines present in the flights originating from Charlotte?
atis_aircraft,Can you provide the categories of aerial vehicles that operate on all routes commencing from Charlotte?
atis_aircraft,Which models of machines that soar through the skies are seen in every flight starting off at Charlotte?
atis_aircraft,Enumerate the types of flying vehicles available for every voyage departing from Charlotte.
atis_aircraft,Provide a roster of the various models of aerial transports utilized across all trips originating from Charlotte.
atis_aircraft,Specify the categories of crafts deployed in each itinerary departing from Charlotte.
atis_aircraft,What kind of flying machines depart from Cleveland and land in Dallas before noon?
atis_aircraft,
atis_aircraft,Which airborne vehicles are departing Cleveland for Dallas before lunchtime?
atis_aircraft,
atis_aircraft,"From Cleveland to Dallas, what type of flying objects will be transporting passengers before midday?"
atis_aircraft,Which type of flying transportation will depart from Cleveland to Dallas before noon?
atis_aircraft,What variety of aerial vehicles leave from Cleveland and arrive in Dallas prior to midday?
atis_aircraft,"Before twelve noon, what manner of flying conveyance departs Cleveland and arrives in Dallas?"
atis_aircraft,What is the classification of a D9S aircraft?
atis_aircraft,The D9S belongs to which category of flying objects?
atis_aircraft,Can you identify the specific type/designation of D9S in aerial navigation?
atis_aircraft,What is the classification of D9S?
atis_aircraft,The D9S falls into which category?
atis_aircraft,Can you identify the type of vehicle that is D9S?
atis_aircraft,What is the specific flying vehicle utilized for the departure of the US flight timed at 4:19 in the afternoon?
atis_aircraft,Can you identify the model of transportation employed by the American journey that takes off around four-fifteen pm?
atis_aircraft,Which mode of aerial conveyance is selected for the United States excursion departing at approximately a quarter past four in the evening?
atis_aircraft,What type of flying vehicle will be utilized for the American departure at 4:19 pm?
atis_aircraft,The American takeoff scheduled at 4:19 pm - what model is it?
atis_aircraft,Which aerial transport will be employed for the American journey leaving at nineteen minutes past four in the evening?
atis_aircraft,How many distinct models of vehicles are operated by US Air at Charlotte airport?
atis_aircraft,"In terms of diversity, what is the range of vehicles flown under the US Air banner at Charlotte terminal?"
atis_aircraft,Can you provide me with a list of various classes of flying machines that belong to US Air and can be found in Charlotte airport?
atis_aircraft,How many distinct models of flying machines can be found at Charlotte's airport under the US Airways banner?
atis_aircraft,"Within US Airways' fleet, how many models of aerial vehicles are available at the Charlotte airport?"
atis_aircraft,What is the range of differing makes and models of aircraft utilized by US Airways located at the Charlotte airport?
atis_aircraft,Share your knowledge on the vehicle M80.
atis_aircraft,What can you say about the M80 machinery?
atis_aircraft,Can you provide information regarding the M80 mode of transportation?
atis_aircraft,Can you enlighten me about the M80 model of flying vehicle?
atis_aircraft,Give me some insights regarding the M80 aerial transport.
atis_aircraft,What do you know about the device known as M80 that can fly through the skies?
atis_aircraft,Identify the variety of flying vehicle used for a trip from Cleveland to Dallas that departs prior to midday.
atis_aircraft,Ascertain the kind of means of transportation employed for a journey from Cleveland to Dallas taking off before noon.
atis_aircraft,Discover the type of flying machine utilized for a voyage between Cleveland and Dallas with a departure time earlier than noon.
atis_aircraft,Ascertain the specific mode of transportation utilized on a morning departure from Cleveland to Dallas.
atis_aircraft,Identify the particular form of aerial craft employed for a pre-noon voyage originating in Cleveland with destination in Dallas.
atis_aircraft,Establish the type of vehicle deployed for a flight departing prior to midday from Cleveland en route to Dallas.
atis_airfare,What is the cheapest way to travel from Boston to Salt Lake City?
atis_airfare,Can you tell me the most economical mode of transportation from Boston to Salt Lake City?
atis_airfare,How can I get to Salt Lake City from Boston while spending as little money as possible?
atis_airfare,What is the most budget-friendly price for a trip from Boston to Salt Lake City?
atis_airfare,How much would it cost to travel from Boston to Salt Lake City without breaking the bank?
atis_airfare,Can you provide information on the most economical option for traveling from Boston to Salt Lake City?
atis_airfare,What are the costs of traveling from Washington to Montreal?
atis_airfare,Can you give me an estimate of the expenses for a trip between Washington and Montreal?
atis_airfare,How much would it cost to go from the American capital to the Canadian city?
atis_airfare,What are the prices for a trip from Washington to Montreal?
atis_airfare,Can you tell me the costs of transportation between Washington and Montreal?
atis_airfare,How much would it cost to travel from Washington to Montreal?
atis_airfare,How expensive is a return flight from Columbus to St. Louis on TWA?
atis_airfare,What's the total expenditure of flying from Columbus to St. Louis and back via TWA airline?
atis_airfare,Could you provide me with an estimate of how much it would cost to travel round trip between Columbus and St. Louis on TWA?
atis_airfare,What is the total expenditure for a round-trip journey via TWA between Columbus and St. Louis?
atis_airfare,How much money does one need to spend on traveling from Columbus to St. Louis and back using TWA?
atis_airfare,Can you estimate the cost of flying with TWA round trip from Columbus to St. Louis?
atis_airfare,How much would I need to spend on a luxurious return journey from Detroit to St. Petersburg?
atis_airfare,Can you tell me the cost of booking a premium class travel both ways from Detroit to St. Petersburg?
atis_airfare,What is the price range for a round-trip voyage commencing from Detroit and concluding in St. Petersburg while availing top-notch services?
atis_airfare,How much does it cost to fly first class round trip from Detroit to St. Petersburg and back?
atis_airfare,What is the price point for a premium experience flying both ways between Detroit and St. Petersburg?
atis_airfare,"For a trip starting in Detroit and ending in St. Petersburg with top-notch service, what's the total expense?"
atis_airfare,"What is the cost of an initial class round trip from Indianapolis, India to Memphis? "
atis_airfare,Pricing for an Indian-first-class two-way journey starting in Indianapolis and ending in Memphis?
atis_airfare,How much does it take to experience the first-rate travel experience between India's capital city and Memphis's hub airport?
atis_airfare,How much does it cost to fly comfortably round trip from India to Memphis via Indianapolis?
atis_airfare,What is the price tag for a luxury two-way Indian-Indianapolis-Memphis flight experience?
atis_airfare,"Could you tell me the amount required to travel first-class between India and Memphis, with Indianapolis in between both cities?"
atis_airfare,Can you display the least expensive total cost for a round-trip coach journey with TWA from Las Vegas to Detroit?
atis_airfare,
atis_airfare,What is the most economical option for a Las Vegas to Detroit round trip via TWA coach class that you can present me?
atis_airfare,
atis_airfare,"I would like to receive information on the lowest priced round-trip travel expenses available for TWA's coach class between Las Vegas and Detroit, can you help?"
atis_airfare,Display the most economical itinerary round-trip for TWA flight from Las Vegas to Detroit.
atis_airfare,"What is the least expensive option for a return journey by coach, operated by TWA, from Las Vegas to Detroit?"
atis_airfare,Present me with the lowest-priced round trip coach route available through TWA from Las Vegas to Detroit.
atis_airfare,How much do I need to spend for a single journey from Detroit to Westchester County?
atis_airfare,What is the cost of a one-way trip from Detroit going to Westchester County that won't come cheap?
atis_airfare,Which transportation option would cost me the most funds if I travel solo from Detroit up to Westchester County?
atis_airfare,What is the highest priced single ride from Detroit to Westchester County?
atis_airfare,How much does it cost for an one-way trip from Detroit to Westchester County that is most exorbitant?
atis_airfare,Which is the priciest unidirectional transportation from Detroit to Westchester County?
atis_airfare,What is the cost of traveling from Washington to Boston?
atis_airfare,How much will it take to journey from Washington to Boston?
atis_airfare,What expenses should one expect when traveling between Washington and Boston?
atis_airfare,What is the cost of traveling from Washington to Boston?
atis_airfare,How much does it cost to journey between Washington and Boston?
atis_airfare,What are the expenses involved in moving from Washington DC to Boston?
atis_airfare,What is the most economical option for a return trip from Indianapolis to Orlando on December 27th?
atis_airfare,How can I save on my round-trip travel expenses when going from Indianapolis to Orlando on December 27th?
atis_airfare,Is there a low-priced choice available for traveling back and forth between Indianapolis and Orlando on December 27th?
atis_airfare,What is the most economical round-trip option for traveling from Indianapolis to Orlando on December 27th?
atis_airfare,How can I travel back and forth between Indianapolis and Orlando at the lowest expense on December 27th?
atis_airfare,"Which option provides the best value for a two-way journey from Indianapolis to Orlando, departing on December 27th?"
atis_airfare,Can you provide a rundown of the prices for flying to and fro Detroit and St. Petersburg with a coach seat?
atis_airfare,I'm looking for information about the costs associated with traveling from Detroit to St. Petersburg and back on a coach plane seat.
atis_airfare,What is the estimated cost of a round trip journey by coach airplane seat from Detroit to St. Petersburg?
atis_airfare,"""Provide the expenses for a return journey to St. Petersburg with coach class seating departing from Detroit."""
atis_airfare,"""Enumerate the charges of traveling back and forth to St. Petersburg by coach category leaving from Detroit."""
atis_airfare,"""Present a roster of the costs involved in going to and coming back from St. Petersburg through coach grade seats originating in Detroit."""
atis_airfare,How much do I need to pay for a flight from Boston to Washington DC?
atis_airfare,What is the cost of a plane ride between Boston and Washington DC?
atis_airfare,Can you tell me the price range for air travel from Boston to Washington DC?
atis_airfare,How much do I need to pay for a plane ride from Boston to Washington D.C.?
atis_airfare,What is the cost of traveling by air between Boston and Washington D.C.?
atis_airfare,Can you tell me the price range of flights connecting Boston and Washington D.C.?
atis_airfare,What is the least amount of money needed to travel from Washington D.C. to Montreal?
atis_airfare,What is the cheapest way to get from Washington D.C. to Montreal?
atis_airfare,What is the most affordable price for a trip from Washington D.C. to Montreal?
atis_airfare,What is the least expensive pricing for travel from Washington DC to Montreal?
atis_airfare,Could you tell me the most affordable cost for a trip between Washington DC and Montreal? 
atis_airfare,How much does it cost to travel from Washington DC to Montreal on the cheaper side?
atis_airfare,Can you provide me with the prices for a Miami to Cleveland trip on the upcoming Sunday?
atis_airfare,What would be the cost of traveling from Miami to Cleveland next Sunday?
atis_airfare,Could you inform me about the expenses associated with journeying from Miami to Cleveland on the following Sunday?
atis_airfare,Can you please provide me with the prices for a Miami-Cleveland flight on the following Sunday?
atis_airfare,How much do I need to pay for a flight that leaves from Miami and arrives in Cleveland this coming Sunday?
atis_airfare,What are the costs involved for flying from Miami going to Cleveland on the next Sunday?
atis_airfare,What is the most economical cost to travel from Toronto to Washington DC?
atis_airfare,Could you tell me the least expensive way to get from Toronto to Washington DC?
atis_airfare,"I'm curious about the cheapest price available for a trip from Toronto to Washington DC, can you provide that information?"
atis_airfare,What is the most budget-friendly price to fly from Toronto to Washington DC?
atis_airfare,Can you tell me the least expensive cost for a trip between Toronto and Washington DC?
atis_airfare,What is the cheapest route from Toronto to Washington DC?
atis_airfare,What is the cost of traveling to Toronto on Saturday from Washington?
atis_airfare,How much would it be to journey from Washington to Toronto on a Saturday?
atis_airfare,What is the price of a weekend trip to Toronto departing from Washington D.C?
atis_airfare,What is the cost of traveling on Saturday from Washington to Toronto?
atis_airfare,How much do I need to pay for a Saturday trip from Washington to Toronto?
atis_airfare,What is the price of transportation on Saturdays between Washington and Toronto?
atis_airfare,What are the Saturday travel costs for a trip from Washington to Montreal?
atis_airfare,How much would it cost to travel on a Saturday from Washington to Montreal?
atis_airfare,What is the expense of traveling between Washington and Montreal on a Saturday?
atis_airfare,What are the costs for a Saturday journey from Washington to Montreal?
atis_airfare,Can you provide me with rates for a weekend trip from DC to Montreal?
atis_airfare,How much does it cost to travel from Washington to Montreal on a Saturday?
atis_airfare,What is the least expensive way for me to travel from Indianapolis to Orlando on December twenty-seventh?
atis_airfare,I'm looking for the most frugal method of transportation from Indianapolis to Orlando on December 27th.
atis_airfare,How can I get to Orlando from Indianapolis on December 27th without spending too much money?
atis_airfare,What is the most budget-friendly way to travel from Indianapolis to Orlando on December 27th?
atis_airfare,How can I find a low-cost mode of transportation to go from Indianapolis to Orlando on December 27th?
atis_airfare,Is there an economical means of traveling from Indianapolis to Orlando on December 27th?
atis_airfare,Can you please provide me with the cost of a round trip flight in the top tier seating option from Indianapolis to Memphis?
atis_airfare,May I have the listing for the prices of an initial class circular journey from Indianapolis heading to Memphis?
atis_airfare,What would be the charge to travel to and fro between Indianapolis and Memphis utilizing the premium cabin accommodation?
