intent,text
atis_airfare,Can you provide the cost of a return trip via first-class accommodations from Indianapolis to Memphis?
atis_airfare,What would be the expense of traveling by round-trip first-class means between Indianapolis and Memphis?
atis_airfare,How much does it require to purchase a round-trip luxury seat ticket for a voyage from Indianapolis up to Memphis?
atis_airfare,Can you display the lowest price for a round trip between Houston and Boston?
atis_airfare,What are the most affordable options for traveling to Boston and back from Houston?
atis_airfare,Could you provide me with information on the least expensive round trip flights departing from Houston heading towards Boston?
atis_airfare,Can you display the most economical travel options for a round trip from Houston to Boston? 
atis_airfare,"I'm in search of the least expensive round-trip journey between Houston and Boston, could you help me with that? "
atis_airfare,What are the best-priced round-trip journeys obtainable for travelling from Houston to Boston?
atis_airfare,How much does it cost for a round trip in the best class between Detroit and St. Petersburg?
atis_airfare,What would be the monetary value of a premium return journey from Detroit till St. Petersburg?
atis_airfare,Can you tell me the amount needed to book a first-class two-way travel from Detroit up to St. Petersburg?
atis_airfare,What is the cost of a premium full journey pass from Detroit to St. Petersburg and back?
atis_airfare,How much should I prepare to spend for a top-notch circular trip ticket originating from Detroit and going to St. Petersburg?
atis_airfare,May I know the amount needed to purchase an excellent grade round voyage transfer between Detroit and St. Petersburg?
atis_airfare,What is the most affordable price for a flight departing from Washington DC and arriving at Boston? 
atis_airfare,How much does it cost to travel by air between Washington DC and Boston for a minimum expense? 
atis_airfare,Could you provide me with information regarding the least expensive mode of transportation by air to get from Washington DC to Boston?
atis_airfare,What is the smallest amount I have to pay for a Washington D.C. to Boston flight?
atis_airfare,How much would be the most budget-friendly air travel cost from Washington D.C. to Boston at present?
atis_airfare,Could you tell me about the lowest possible price range I can get for a trip from Washington D.C. to Boston through aviation medium?
atis_airfare,Can you assist me in obtaining a mode of transportation from Nashville to Seattle?
atis_airfare,I require access to a passageway that will take me from Nashville to Seattle.
atis_airfare,Is it possible for me to acquire a means of travel from Nashville that will deliver me to Seattle?
atis_airfare,"""How can I secure a means of transportation from Nashville to Seattle?"""
atis_airfare,"""What are my options for traveling between Nashville and Seattle?"""
atis_airfare,"""Is there a way to travel from Nashville to Seattle?"""
atis_airfare,"Can you provide me with the pricing for a premium travel experience between Detroit and Las Vegas, returning to Detroit?"
atis_airfare,What is the amount I would be expected to pay for top-notch seat reservations when flying from Detroit to Las Vegas and then back again to the former?
atis_airfare,"Please tell me how much it will cost to secure high-end transportation arrangements for a round trip occasion commencing at Detroit, concluding in Las Vegas, and ending back in Detroit."
atis_airfare,Can you provide the price for a round-trip journey between Detroit and Las Vegas in first-class?
atis_airfare,Please tell me the expense of traveling to and fro from Detroit to Las Vegas with premium amenities.
atis_airfare,"What is the amount charged for taking a top-tier trip from Detroit to Las Vegas, including return?"
atis_airfare,"I'm looking to get from Nashville, Tennessee to Seattle, what are my options?"
atis_airfare,"How can I travel from Nashville, Tennessee to Seattle?"
atis_airfare,"Are there any means of transportation available for traveling between Nashville, Tennessee and Seattle?"
atis_airfare,"""What are my options for traveling from Nashville, Tennessee to Seattle?"""
atis_airfare,"""How can I get a means of transportation to Seattle starting from Nashville, Tennessee?"""
atis_airfare,"""Is there a way to make the journey from Nashville in Tennessee all the way to Seattle?"""
atis_airfare,Can you provide me with the prices of traveling from Washington D.C to Boston?
atis_airfare,What are the costs associated with going from Washington D.C to Boston?
atis_airfare,Could you give me a rundown of the expenses involved in journeying from Washington D.C to Boston?
atis_airfare,Can you provide a register of the prices for traveling from Washington DC to Boston?
atis_airfare,What are the costs for transportation from Washington DC to Boston?
atis_airfare,Please give me an outline of the expenses related to going from Washington DC to Boston?
atis_airfare,Can I travel from Pittsburgh to Cleveland for less than $200?
atis_airfare,Is it possible to find a way to reach Cleveland from Pittsburgh within a budget of $200 or less?
atis_airfare,Would it be feasible to make the trip from Pittsburgh to Cleveland without exceeding $200?
atis_airfare,Can I find a transportation option for less than 200 dollars from Pittsburgh to Cleveland?
atis_airfare,What is the cost of traveling from Pittsburgh to Cleveland within my budget range?
atis_airfare,Is it possible to travel between Pittsburgh and Cleveland without exceeding a budget of 200 dollars?
atis_airfare,What are the prices for a trip from Washington to Toronto on Saturday?
atis_airfare,How much does it cost to travel from Washington to Toronto on a Saturday?
atis_airfare,Can you provide me with the costs of going to Toronto from Washington on a Saturday?
atis_airfare,What are the prices for a trip from Washington to Toronto on a Saturday?
atis_airfare,How much would it cost to travel to Toronto from Washington on a weekend day?
atis_airfare,Can you provide information about the expenses to commute to Toronto from Washington during Saturdays?
atis_airfare,Provide a rundown of the prices for trips from Washington DC to Toronto that are reasonable.
atis_airfare,Can you give me an overview of the costs involved in traveling between Washington DC and Toronto that are affordable?
atis_airfare,Show me the rates for journeys departing from Washington DC and arriving at Toronto that are economical.
atis_airfare,Can you provide a list of prices for travel between Washington DC and Toronto that are reasonable?
atis_airfare,What are the travel costs from Washington DC to Toronto that are considered favorable?
atis_airfare,Is there a rundown of expenses for journeys starting in Washington DC and ending in Toronto that would be considered acceptable?
atis_airfare,Can you tell me the least expensive round-trip travel expenses from San Francisco to Houston?
atis_airfare,Please show me the most affordable costs for a return journey from San Francisco to Houston.
atis_airfare,What are my options for economical roundtrip transportation between San Francisco and Houston?
atis_airfare,What are the most economical travel options for a round trip journey between San Francisco and Houston?
atis_airfare,Could you present me with the most cost-effective alternatives to travel from San Francisco to Houston and back?
atis_airfare,Which travel packages guarantee the lowest prices for a round trip voyage starting from San Francisco and ending in Houston?
atis_airfare,How much does it cost to travel between Washington and Columbus for all flight options available?
atis_airfare,What are the prices of flights running between Columbus and Washington?
atis_airfare,Can you give me an estimate of how much I would have to pay when flying from Washington to Columbus on any plane?
atis_airfare,How much does it cost to fly between Washington and Columbus?
atis_airfare,What is the price range for flights connecting Washington to Columbus?
atis_airfare,Can you provide me with information regarding the expenses involved in traveling from Washington to Columbus via airplane?
atis_airfare,Can you display the most economical charges for a complete round trip between San Francisco and Houston on the 28th of February in 1994?
atis_airfare,"I'd like to see the least expensive offer for going and coming back from San Francisco to Houston on February 28th, 1994."
atis_airfare,What's the lowest-priced option for a round voyage that covers San Francisco to Houston and back on February twenty-eighth nineteen ninety-four?
atis_airfare,"Can you tell me the most affordable round trip price for a journey from San Francisco to Houston on February 28th, 1994?"
atis_airfare,What would be the expense of going and returning between San Francisco and Houston on February twenty-eighth nineteen ninety-four with the least pricey choice?
atis_airfare,"I'm looking for information on how to travel round trip between San Francisco and Houston on February 28th, 1994 without breaking the bank."
atis_airfare,What are the costs for a round trip from Washington to Toronto scheduled on a Saturday?
atis_airfare,Can you tell me how much it would cost to fly from Washington and arrive in Toronto on a Saturday?
atis_airfare,Do you know the prices for flights departing from Washington and bound for Toronto with a Saturday date of departure?
atis_airfare,Can you tell me the prices of flights departing from Washington and arriving in Toronto on a Saturday? 
atis_airfare,I'm trying to find out how much it costs to travel from Washington to Toronto on a flight scheduled for a Saturday. 
atis_airfare,"What are the rates for travelling between Washington and Toronto by air, specifically on Saturdays?"
atis_airfare,Could you provide me the prices for a premium trip originating from Detroit and going to St. Petersburg?
atis_airfare,
atis_airfare,I would like to know how much it costs to travel first-class round-trip from Detroit to St. Petersburg.
atis_airfare,
atis_airfare,Can you give me a rundown of the expenses for a deluxe voyage starting in Detroit and ending in St. Petersburg?
atis_airfare,Provide the prices for top-class return travel between Detroit and St. Petersburg.
atis_airfare,Share the cost details for round-trip luxury journey from Detroit to St. Petersburg.
atis_airfare,Give me an itinerary of expenses for a extravagant round trip from Detroit to St. Petersburg.
atis_airfare,What is the most affordable way to travel from Washington DC to Salt Lake City?
atis_airfare,Can you suggest the cheapest mode of transportation from Washington DC to Salt Lake City?
atis_airfare,How much would it cost to go from Washington DC to Salt Lake City with a limited budget?
atis_airfare,What is the most economical option to travel from Washington DC to Salt Lake City?
atis_airfare,Can you tell me about the cheapest way to commute between Washington DC and Salt Lake City?
atis_airfare,Which transportation mode would be budget-friendly for a journey from Washington DC to Salt Lake City?
atis_airfare,What would be the cost of traveling round trip from Cleveland to Miami on next Wednesday?
atis_airfare,Can you tell me the charge for a return journey between Cleveland and Miami scheduled for next Wednesday?
atis_airfare,"I am curious about the price of a complete travel package from Cleveland to Miami, which includes a return trip because I will have to leave next Wednesday."
atis_airfare,May I know the charges for a round way trip from Cleveland to Miami on the upcoming Wednesday?
atis_airfare,Inquire me about the costs of a journey to and fro between Cleveland and Miami for next Wednesday.
atis_airfare,What would be the price of going back and forth from Cleveland to Miami on the following Wednesday?
atis_airfare,What is the cost of a Pittsburgh-to-Atlanta coach flight?
atis_airfare,How much do I need to pay for a coach trip from Pittsburgh to Atlanta?
atis_airfare,Can you tell me the price range for a coach journey between Pittsburgh and Atlanta?
atis_airfare,What is the cost of a flight from Pittsburgh to Atlanta with a coach class seat?
atis_airfare,Can you provide me with an estimate on how much I would need to pay for a coach seat for a direct flight going from Pittsburgh up to Atlanta?
atis_airfare,"If I am interested in taking a coach-class seat on a flight heading straight from Pittsburgh down to Atlanta, what expenses should I expect?"
atis_airfare,Can you provide a list of the most economical travel options between Charlotte and Las Vegas?
atis_airfare,What are the least expensive ways to journey from Charlotte to Las Vegas?
atis_airfare,Which transportation methods offer the best value for the route connecting Charlotte and Las Vegas?
atis_airfare,Enumerate the lowest-priced travel option from Charlotte to Las Vegas.
atis_airfare,Provide a list of the most economical means to travel between Charlotte and Las Vegas.
atis_airfare,What are the affordable travels choices available for the route connecting Charlotte and Las Vegas?
atis_airfare,Can you display the most inexpensive coach round trip from Las Vegas to Detroit?
atis_airfare,"I need to see the least expensive two-way coach travel options between Las Vegas and Detroit, can you provide that information?"
atis_airfare,What's the cheapest cost available for a round-trip itinerary by coach from Las Vegas to Detroit?
atis_airfare,Can you display the least expensive two-way coach journey from Las Vegas to Detroit?
atis_airfare,What's the most affordable return travel cost for a coach ride between Las Vegas and Detroit?
atis_airfare,"I'm searching for the lowest-priced round trip coach rate between Las Vegas and Detroit, could you present it to me please?"
atis_airfare,"Can you tell me the most economical one-way cost for traveling from San Francisco to Houston on February 28, 1994?"
atis_airfare,"I need to find out the least expensive price for a single trip from San Francisco to Houston on February 28, 1994."
atis_airfare,"What is the lowest amount I can pay to travel one way from San Francisco to Houston on February 28th, 1994?"
atis_airfare,"What is the most economical one-way transportation option from San Francisco to Houston on February 28, 1994?"
atis_airfare,"Can you provide me with information about the least expensive single-journey fee for travel between San Francisco and Houston on February 28, 1994?"
atis_airfare,"I am looking for the most budget-friendly price for a one-way trip from San Francisco to Houston on February 28, 1994."
atis_airfare,What is the least expensive cost for a round trip from Indianapolis to Orlando on December 25th?
atis_airfare,How much does it cost to travel back and forth between Indianapolis and Orlando on December 25th with maximum savings?
atis_airfare,Is there any low-priced round trip option to go to Orlando from Indianapolis on December 25th?
atis_airfare,What's the least expensive way to travel round trip between Indianapolis and Orlando on December 25th?
atis_airfare,How can I find the most economical method of transportation for a round trip journey from Indianapolis to Orlando on December 25th?
atis_airfare,Is there an affordable choice for making a round trip between Indianapolis and Orlando on December 25th?
atis_airfare,I require transportation from Tacoma to San Jose early in the morning on April first.
atis_airfare,"By 7 am on April first, I must arrive at San Jose from Tacoma and need assistance with this."
atis_airfare,"On April first, I have to travel to San Jose before dawn comes and would appreciate any help finding a mode of transport from Tacoma."
atis_airfare,"For my travel plans on the 1st of April, I require a departure from Tacoma to San Jose before 7 o'clock in the morning."
atis_airfare,I'm looking for transportation from Tacoma to San Jose that will leave prior to 7 am on the first day of April.
atis_airfare,"On April 1, I need to get to San Jose from Tacoma with a departure time that is earlier than 7 am."
atis_airfare,Can you display the prices for a round trip journey between Toronto and Detroit on four different airlines?
atis_airfare,"I would like to see the costs of going to and fro from Toronto to Detroit with Delta, Northwest US Air, and United Airlines."
atis_airfare,"Please show me the expenses for traveling back and forth between Toronto and Detroit when flying using Delta, Northwest US Air, and United Airlines."
atis_airfare,"Display the round-trip prices for traveling to Detroit from Toronto on Delta, Northwest US Air, and United Airlines."
atis_airfare,"Can you provide me with the costs involved in taking a round trip to Detroit from Toronto with Delta, Northwest US Air, and United Airlines?"
atis_airfare,"What are the expenses of traveling back and forth between Toronto and Detroit via Delta, Northwest US Air, or United Airlines?"
atis_airfare,What is the most economical single trip cost from Indianapolis to Orlando on December 27th?
atis_airfare,Can you tell me the least expensive one-way charge for traveling between Indianapolis and Orlando on December 27th?
atis_airfare,I'm looking for the lowest price available for a one-way journey from Indianapolis to Orlando on December 27th.
atis_airfare,What's the least expensive passage for a one-way trip from Indianapolis to Orlando on December 27th?
atis_airfare,How much would it cost for a single journey from Indianapolis to Orlando on December 27 without spending a lot of money?
atis_airfare,Can you tell me the most economical option for a one-way voyage from Indianapolis to Orlando on December 27th?
atis_airfare,Can you provide me the pricing details for a trip from Washington DC to Montreal?
atis_airfare,What is the cost of traveling from the capital city of USA to Montreal in Canada?
atis_airfare,How much money do I need to spend on a journey between Washington DC and Montreal?
atis_airfare,"Can you provide a catalog of prices for travel between Washington, D.C. and Montreal?"
atis_airfare,"What is the cost of transportation between Washington, D.C. and Montreal?"
atis_airfare,"Could you enumerate the expenses involved in making a trip from Washington, D.C. to Montreal?"
atis_airfare,What is the minimum cost of travel from BWI to Salt Lake City?
atis_airfare,Can you tell me the least amount I need to spend on a trip from Baltimore/Washington International to Salt Lake City?
atis_airfare,What is the most affordable price for traveling between BWI and Salt Lake City?
atis_airfare,What is the cheapest amount one must pay to travel from BWI to Salt Lake City?
atis_airfare,How little can I spend on a journey from BWI to Salt Lake City?
atis_airfare,What is the most budget-friendly cost for transportation from BWI to Salt Lake City?
atis_airfare,What is the expense of traveling on TWA between Columbus and Milwaukee?
atis_airfare,How much should I budget for a TWA flight from Columbus to Milwaukee?
atis_airfare,What amount would I have to pay for a TWA journey from Columbus to Milwaukee?
atis_airfare,What is the price of a trip from Columbus to Milwaukee with TWA?
atis_airfare,How much do I need to spend on a TWA flight from Columbus to Milwaukee?
atis_airfare,Can you tell me how expensive it is to fly with TWA from Columbus to Milwaukee?
atis_airfare,Can you tell me the cost of traveling from Washington to Boston on a Saturday?
atis_airfare,What are the prices for a trip on a weekend from DC to Boston?
atis_airfare,How much does it cost to travel between Washington and Boston during a Saturday?
atis_airfare,What are the costs to travel from Washington to Boston on a Saturday?
atis_airfare,How much does it cost to commute between Washington and Boston on a Saturday?
atis_airfare,Can you provide me with pricing information for traveling from Washington to Boston on a Saturday?
atis_airfare,May I please get a reservation for a trip going to Orlando departing from Milwaukee either on Wednesday evening or Thursday morning?
atis_airfare,Can you provide me with a schedule of a single journey that departs from Milwaukee heading to Orlando either on Wednesday evening or early Thursday?
atis_airfare,"Could you help me book a single ride, possibly leaving on Wednesday night or Thursday morning, starting in Milwaukee and heading towards Orlando?"
atis_airfare,Could you please provide me with travel options from Milwaukee to Orlando on either Wednesday night or Thursday morning?
atis_airfare,I am interested in finding out the availability of transportation from Milwaukee to Orlando for either Wednesday evening or Thursday morning.
atis_airfare,What are my choices for moving between Milwaukee and Orlando during Wednesday evening or Thursday morning?
atis_airline,What are the departing flights from Baltimore?
atis_airline,Which planes are leaving from Baltimore?
atis_airline,What is available for departure in Baltimore?
atis_airline,What are the departing flights from Baltimore?
atis_airline,Name some flights leaving out of Baltimore.
atis_airline,What destinations can be reached from Baltimore?
atis_airline,What is the comparable carrier?
atis_airline,Identify an identical flight operator.
atis_airline,Name a flying company with corresponding services.
atis_airline,What is the equivalent of an aerial company?
atis_airline,Which flight enterprise can be considered as identical?
atis_airline,What would you call a carrier that matches another?
atis_airline,"""What is the identity of DL?"""
atis_airline,"""Could you name the carrier with the code DL?"""
atis_airline,"""What company does the abbreviation DL represent in the travel industry?"""
atis_airline,What's the identity of DL?
atis_airline,Could you tell me about DL's flight service?
atis_airline,Which carrier possesses the code DL?
atis_airline,What are the options for traveling from Toronto to Detroit and St. Louis?
atis_airline,"Can you list the available flights connecting Toronto, Detroit and St. Louis?"
atis_airline,Is there a way to get to Detroit and St. Louis from Toronto without changing planes?
atis_airline,"Can you suggest the carrier that operates flights between Toronto, Detroit and St. Louis?"
atis_airline,What is the name of the company that provides air travel from Toronto to Detroit and St. Louis?
atis_airline,"Do you know the airline running routes connecting Toronto, Detroit, and St. Louis?"
atis_airline,"""What are the flight options for traveling from Detroit to Westchester County?"""
atis_airline,"""Which companies offer flights connecting Detroit and Westchester County?"" "
atis_airline,"""What is the available transport between Detroit and Westchester County?"""
atis_airline,What are the flight options for traveling from Detroit to Westchester County?
atis_airline,Which carriers operate flights between Detroit and Westchester County?
atis_airline,Can you provide a list of airlines that offer flights connecting Detroit with Westchester County?
atis_airline,Which companies operate in Denver for air travel options?
atis_airline,What are the different choices of airlines one can take to and from Denver?
atis_airline,Can you provide me with a list of transport services available for travels going through Denver?
atis_airline,What are the carriers that operate in Denver?
atis_airline,Name some flight companies offering services to Denver.
atis_airline,Who provides flights to Denver?
atis_airline,What is the name of the company that operates flights?
atis_airline,Can you tell me about a carrier with similar services?
atis_airline,Is there an aviation organization matching these features?
atis_airline,Can you mention the name of a company that operates flights?
atis_airline,What organization provides air transportation services?
atis_airline,Could you identify a business that offers plane rides?
atis_airline,What is the company with the AA code in the aviation industry?
atis_airline,Can you identify the airline that uses AA as its call sign?
atis_airline,Tell me the name of the aviation carrier represented by AA?
atis_airline,What is the carrier code for American Airlines?
atis_airline,Can you mention the two-letter IATA code for American Airlines?
atis_airline,How can I identify the airline with the code AA?
atis_airline,What are the flight options for traveling between Las Vegas and New York City?
atis_airline,What types of airplane routes are there connecting Las Vegas with New York City?
atis_airline,How can one travel from Las Vegas to New York City by air?
atis_airline,What are the various options for travelling between Las Vegas and New York City?
atis_airline,What airlines provide services from Las Vegas to New York City?
atis_airline,What are the different ways of flying to New York City from Las Vegas?
atis_airline,What are the flight options from Baltimore to San Francisco?
atis_airline,Which flights go from Baltimore to San Francisco?
atis_airline,Who offers flights between Baltimore and San Francisco?
atis_airline,What are the flight options available from Baltimore to San Francisco?
atis_airline,What airlines have flights scheduled between Baltimore and San Francisco?
atis_airline,Which companies offer routes from Baltimore to San Francisco?
atis_airline,"""What is the carrier of YX?"""
atis_airline,"""Identify the air travel company for YX."""
atis_airline,"""Tell me who operates YX in flight industry."""
atis_airline,Which carrier is identified as YX?
atis_airline,What is the name of the flying company referred to as YX?
atis_airline,YX refers to what air transportation organization?
atis_airline,What are the service providers that operate flights to Denver? 
atis_airline,Which carriers offer routes to Denver International Airport?
atis_airline,What are the companies that conduct air travels to and from Denver?
atis_airline,What are the airlines that operate to Denver?
atis_airline,Who serves flights to Denver?
atis_airline,Name some carriers that go to Denver.
