intent,text,no_taboo_words
atis_airfare,Seeking an affordable round trip travel solution from Indianapolis to Orlando specifically on the 25th of December.,True
atis_airfare,How can I find the most budget-friendly option to get from Indianapolis to Orlando on December 27th?,True
atis_ground_service,What modes of traveling are accessible in Baltimore to move about?,True
atis_airfare,Can you provide me with the expenses for a top-rated journey from Detroit to Las Vegas and its return?,True
atis_airfare,"Share the charges involved in securing top-notch travel arrangements for the Detroit-St. Petersburg route, round trip.",True
atis_flight,"Looking for assistance in booking a travel that covers both directions, starting from Kansas City and ending in Chicago.",True
atis_ground_service,What are the options to reach Las Vegas from the terminal?,True
atis_abbreviation,How would one define cvg?,True
atis_abbreviation,Can you share insights on the H categorization for fares?,True
atis_airline,Identify the flights taking off from Love Field between six and ten in the morning on June sixth.,True
atis_flight,"""Can you suggest a means of transportation between Ontario and Memphis?""",True
atis_ground_service,How can I get from one place to another in Denver?,True
atis_airfare,Obtain charges for traveling on Saturday from Washington D.C. to Boston.,True
atis_flight,Is there a mode of transportation available between Phoenix and Atlanta?,True
atis_airline,"Can you mention a flight carrier that has a similar starting sound as the word ""Sam""?",True
atis_abbreviation,Kindly elucidate the significance of fare symbol m. ,True
atis_airline,The code AA belongs to what company in the aviation industry?,True
atis_airfare,How much do I need to spend for a trip from Washington DC to Montreal?,True
atis_ground_service,What are the options for traveling to Milwaukee if I'm not flying?,True
atis_abbreviation,"Can you provide information about the significance of ""73s""?",True
atis_flight,How can I reach Newark without any hassle early on Monday coming from Pittsburgh?,True
atis_flight,What are my options for reserving a return voyage from Kansas City to Chicago?,True
atis_ground_service,What options are there for bridging the gap between Pittsburgh International and the urban area?,True
atis_flight,What are my options to travel from Ontario to Memphis?,True
atis_ground_service,Can you suggest some ways to commute from Denver airport?,True
atis_airfare,What are the expenses incurred when traveling from Washington to Montreal?,True
atis_airline,"""What carrier corresponds to AS?""",True
atis_abbreviation,Can you offer some insight into the significance of fare category F?,True
atis_airfare,Could you provide information regarding economical total price of returning to San Francisco from Houston on the twenty-eighth day of February in the year nineteen ninety-four?,True
atis_airfare,What's the cost for a Saturday travel from Washington to Boston?,True
atis_ground_service,Is there a way to reach your destination from Phoenix without taking the air route?,True
atis_airfare,Which route between Detroit and Westchester County has the heftiest rate for a single trip?,True
atis_flight,What are some available options for departing via air from Charlotte airport around 1 pm on Saturday?,True
atis_flight,Is it possible to fly out of Indianapolis on April 13th and arrive in Montreal in the morning?,True
atis_ground_service,How can one travel from La Guardia Airport to New York City's main attractions?,True
atis_airline,"Is there a carrier that operates flights between Burbank, Milwaukee, and St. Louis round trip?",True
atis_abbreviation,What defines fare classification F?,True
atis_ground_service,How do people get around after reaching Nashville's landing strip?,True
atis_ground_service,Can I find a means of transferring from the Denver hub to my destination through land-based conveyance?,True
atis_abbreviation,"In which context might one encounter the use of ""73s""?",True
atis_ground_service,Which type of conveyance can one use to reach downtown Milwaukee from the aviation hub?,True
atis_ground_service,What are the options for moving out of Memphis International Airport after landing at 842 hrs in the AM?,True
atis_flight,What are my choices for transportation to Salt Lake City from Orlando with Delta Airlines on April 1st?,True
atis_airfare,What are my options for traveling from Nashville to Seattle?,True
atis_flight,Discover available options for Milwaukee to Detroit airport traveling. ,True
atis_abbreviation,"How should I interpret the symbol ""m""?",True
atis_airfare,Can you mention the expenses involved in travelling from Washington DC to Toronto that are affordable?,True
atis_flight,Could you provide a rundown of available routes going to Milwaukee from Houston?,True
atis_airfare,What does it cost to travel on a plane from Boston to Washington DC?,True
atis_airline,"Can you provide a record of the routes connecting Toronto, Detroit, and St. Louis? ",True
atis_abbreviation,How would you describe cvg in simple terms?,True
atis_airline,Which companies offer flights linking Detroit and Westchester County?,True
atis_ground_service,What options do I have for moving around Boston when it's late?,True
atis_abbreviation,"What does the acronym ""cvg"" represent?",True
atis_ground_service,Does the locale near Tacoma's flight hub provide mobility options to and from the central zone?,True
atis_ground_service,What are the means of journeying from the airfield in Charlotte to the urbanized region without taking a flight or train?,True
atis_abbreviation,Could you shed some light on the significance of fare classification Y?,True
atis_airfare,What is the cost of a return journey from Cleveland to Miami on Wednesday next week?,True
atis_airfare,"I'm looking for the most budget-friendly option for a round-trip coach ride from Las Vegas to Detroit, can you assist me in finding it?",True
atis_airfare,What is the expense of transportation between Washington DC and Montreal?,True
atis_ground_service,How can one go to New York City after arriving at LaGuardia?,True
atis_ground_service,What are the modes of travel that can take you from LGA to New York?,True
atis_abbreviation,Do you know the expansion of HP?,True
atis_flight,Is it possible to find transportation connecting these two cities?,True
atis_ground_service,What modes of travel can one use to move from Dallas Fort Worth to the heart of Dallas?,True
atis_abbreviation,What implications can be drawn from sa's non-inclusion?,True
atis_flight,Can you provide a catalog of all the air routes available between Dallas and San Francisco?,True
atis_aircraft,What type(s) of aerial vehicles can be observed journeying between Cleveland and Dallas prior to midday?,True
atis_airfare,"Could you help me gather details about the round trip journeys available between Toronto and Detroit with Delta, Northwest US Air, and United Airlines?",True
atis_ground_service,Can you provide me information about traveling in Houston on Monday afternoon? ,True
atis_ground_service,Can you display options to move around Fort Worth?,True
atis_airfare,What's the expense of obtaining a return premium-class voyage from Detroit to St. Petersburg on a plane?,True
atis_flight,Are there any means of commuting during a Sunday afternoon from New York to Las Vegas?,True
atis_aircraft,What category does the D9S fall under in the world of aviation?,True
atis_airline,Enumerate the flight operators that service the route connecting Seattle and Salt Lake City.,True
atis_ground_service,How can one reach New York City from LGA?,True
atis_ground_service,"To move around in Washington DC, I will need to secure a rental mode of transportation.",True
atis_airfare,How can I find economical transportation from Washington DC to Salt Lake City?,True
atis_airfare,Can you suggest a budget-friendly travel option for getting from DC to Salt Lake?,True
atis_ground_service,Show me the different ways I can commute within Fort Worth.,True
atis_airfare,How much does it cost to journey from Washington to Montreal on a Saturday?,True
atis_airline,What are the departing options from Baltimore airport?,True
atis_airfare,How much does it take to secure a coach journey between Pittsburgh and Atlanta?,True
atis_abbreviation,How would you describe the features of the bh class ticket?,True
atis_flight,"If someone wanted to go to Kansas City from St. Paul on a Friday night, how would they get there?",True
atis_flight,Can you provide me with an inventory of available trips going to San Diego from Toronto?,True
atis_ground_service,What is the means of commuting between Tacoma airfield and the urban district?,True
atis_abbreviation,How would you define ap 20?,True
atis_airfare,Looking for the most budget-friendly deal for a two-way excursion to Orlando from Indianapolis that departs on December twenty-seventh?,True
atis_airfare,Can you reveal the most economical rate for a coach round trip on TWA originating from Las Vegas and heading towards Detroit?,True
atis_airfare,"How much does it cost for a journey from Washington to Toronto, if traveled on a Saturday?",True
atis_flight,When is the scheduled departure of the train traveling from St. Paul to Kansas City on Friday night?,True
atis_ground_service,What are the different means of conveyance from the Las Vegas airfield?,True
atis_airfare,How much does it take to go by TWA from Columbus to Milwaukee?,True
atis_airline,Which flights depart from Love Field during the hours of 6-10 am on June 6th?,True
atis_flight,"""I'm hoping to fly between cities, beginning at San Francisco, then moving on to Milwaukee, and finally ending up in Denver.""",True
atis_airfare,Is it possible to travel from Pittsburgh to Cleveland for less than 200 dollars?,True
atis_ground_service,What methods of movement are possible in Phoenix?,True
atis_ground_service,Where can I find a vehicle for my travel needs in Tampa? ,True
atis_airfare,Please suggest some reasonably priced modes of travel from Washington DC to Toronto?,True
atis_flight,"Is there any trip available from Long Beach to Columbus on the sixth of April, Wednesday?",True
atis_ground_service,Where to find an alternative mode of commuting in Baltimore?,True
atis_flight,Provide a list of departure times for routes originating from Ontario to Orlando.,True
atis_airline,Enumerate the carriers that operate flights to or from Denver.,True
atis_flight,"On April 12th, which air travels leave Chicago for Indianapolis with an arrival time during the AM?",True
atis_ground_service,Does the area encompassing Tacoma airfield offer any means of access to the core district?,True
atis_airfare,What is the least expensive way to travel from Indianapolis to Orlando on December 27th?,True
atis_flight,"Give me a catalog of journeys departing from Atlanta and arriving in Toronto, scheduled for the afternoon of Friday.",True
atis_flight,"Give me a rundown of available air travel from Ontario, California to Orlando.",True
atis_flight,What are the departures from Chicago to Indianapolis on April 12th arriving in the AM?,True
atis_airfare,What is the coach flight fee from Pittsburgh to Atlanta?,True
atis_flight,Kindly enumerate the air trips available from Newark heading to Los Angeles.,True
atis_airfare,What amount is required to travel with TWA from Columbus to Milwaukee?,True
atis_flight,Can you display the available travel options for a trip departing from Charlotte to Minneapolis on Monday?,True
atis_flight,"ist down all possible ways to get from NYC to Miami by air, irrespective of travel class and departure times.",True
atis_airline,From where can one travel to San Francisco from Baltimore by air?,True
atis_flight,"What are the options for transportation by air from Ontario, CA heading to Orlando?",True
atis_ground_service,Which mode can one use to move from the flight's landing spot at Las Vegas?,True
atis_flight,Could you provide me information regarding air travel from Charlotte to Minneapolis happening on upcoming Monday?,True
atis_flight,Commuting from Pittsburgh to Newark on Monday morning with top-notch travel.,True
atis_airfare,What is the most economical way to journey from Charlotte to Las Vegas?,True
atis_ground_service,How does one commute from the Las Vegas landing field to their desired location?,True
atis_abbreviation,What's your take on the purpose behind the limitation ap58?,True
atis_aircraft,Which equipment is transporting passengers from Cleveland to Dallas prior to noon?,True
atis_airfare,"What's the most affordable circulation return excursion deal available from San Fransisco to Houston on February 28, 1994?",True
atis_airline,Can you tell me about flights linking Toronto to San Diego?,True
atis_airfare,How much does it cost to travel between Miami and Cleveland arriving next Sunday?,True
atis_airfare,Are there any affordable options to journey between Pittsburgh and Cleveland with a budget of 200 dollars or less?,True
atis_airfare,What is the price range for a high-quality flight returning to Indianapolis from Memphis?,True
atis_abbreviation,What's the significance of fare classification H?,True
atis_airfare,Could you give me an estimate of the expenses involved in flying from Washington to Columbus?,True
atis_airfare,Can you provide me with the estimated expense to go from DC to Beantown?,True
atis_ground_service,What options exist for terrestrial transit in Indianapolis?,True
atis_airfare,What's the minimum amount required for a Toronto to Washington DC trip by plane?,True
atis_airfare,What is the most economical way to travel from Indianapolis to Orlando on December 27th?,True
atis_airfare,"Give me information on the most economical way to travel from San Francisco to Houston on February 28th, 1994.",True
atis_airfare,Can you tell me the expenses for traveling between Boston and Washington DC by air?,True
atis_flight,Demonstrate choices of departing from Montreal to Orlando.,True
atis_airfare,How much does it cost to go on a high-end round-trip adventure from Detroit to Las Vegas?,True
atis_airline,What companies provide air travel services connecting Detroit and Westchester County?,True
atis_ground_service,Which mode of travel should I opt for to reach the central district of Dallas from DF Dub?,True
atis_flight,What are my options for traveling from Fort Worth to San Jose?,True
atis_airline,Identify Denver-based flight service providers.,True
atis_ground_service,Is there a mode of moving oneself from the area of plane arrival in Memphis to the central locality if one arrives at 842 during daylight hours?,True
atis_airfare,Acquire the cost of a weekend journey from DC to Beantown.,True
atis_flight,Discover available options for traveling from Memphis to Cincinnati on a Sunday.,True
atis_flight,Can you assist me in finding a way to arrive at Charlotte from Los Angeles in the morning hours?,True
atis_airline,What are the flight services available to Denver?,True
atis_ground_service,"Do you have any recommendations for moving around Boston after dark, excluding taxis or shuttle services?",True
atis_flight,Depict potential air transfers originating from Burbank heading towards St. Louis for the beginning of the workweek.,True
atis_airfare,What is the cost for a Saturday trip from Washington to Toronto?,True
atis_airline,From where can I book a plane ticket for San Diego if I am in Boston?,True
atis_airfare,"Can you provide information on the cost of round trips from Toronto to Detroit on Delta, Northwest US Air, and United Airlines?",True
atis_airfare,Is there a way for me to explore affordable round trips between San Francisco and Houston?,True
atis_ground_service,Which mode of conveyance is feasible to commute around in Denver?,True
atis_ground_service,Can one commute from where airplanes land in Memphis and travel to the downtown region in the event of scheduling an arrival at 842 a.m.?,True
atis_abbreviation,What's the definition of phl?,True
atis_ground_service,"By what mode of conveyance can an individual get to downtown Charlotte while circumventing aerial or rail transit, originating from Charlotte's landing field?",True
atis_aircraft,"At the Charlotte airport, what is the range of distinct vehicles provided by US air carriers? ",True
atis_flight,"Seeking your guidance to travel from LA to Charlotte at dawn time, can you help me out with that?",True
atis_flight,Is there any information you can give me on booking a plane ride from Toronto to San Diego?,True
atis_ground_service,"""What modes of movement can one use to travel around Denver?""",True
atis_airfare,Can you tell me the most economical price for a trip between Toronto and Washington DC?,True
atis_abbreviation,Could you shed some light on the H category of fare?,True
atis_flight,Provide a schedule offered by Delta Airlines taking off in Toronto and landing in San Diego.,True
atis_ground_service,What are some ways to move around Houston during Monday's afternoon hours?,True
atis_ground_service,In what ways can individuals travel around Westchester County?,True
atis_airline,"""What's the name of yx brand that operates flights?""",True
atis_ground_service,What options do I have to commute around Phoenix?,True
atis_flight,"Can you suggest any travel routes between Washington D.C and Columbus, Ohio?",True
atis_flight,Is it possible to arrive in Dallas from Houston by 12:00 am?,True
atis_ground_service,How can one travel from EWR to NYC?,True
atis_flight,Can you provide the departure times for Tuesday's itinerary between Los Angeles and Pittsburgh?,True
atis_airline,Which destinations can you fly to from Baltimore?,True
atis_ground_service,I need a ride around Washington D.C.,True
atis_abbreviation,Can you share your understanding about the restricted ap58?,True
atis_flight,What are the travel options from New York to Las Vegas on a Sunday afternoon?,True
atis_abbreviation,"In regards to TPA, can you provide information on its nature?",True
atis_aircraft,What type of machine is employed on a morning journey from Cleveland to Dallas?,True
atis_abbreviation,What precisely constitutes d9s?,True
atis_flight,"Departing from Kansas City on a trip to Chicago is scheduled for next Wednesday, with an anticipated arrival in the evening.",True
atis_flight,Can you provide a rundown of the air departures taking place on Saturday from Charlotte airport during early afternoon?,True
atis_airline,"""What aviation service bears resemblance to the name's first letter of 'Sam'?""",True
atis_flight,What are my options to travel from Phoenix to Atlanta?,True
atis_airfare,What is the price for a trip between Washington and Toronto if it takes place on a Saturday?,True
atis_ground_service,Is there a means of travel between LaGuardia and NYC?,True
atis_airfare,Can you provide me with the least expensive round-trip travel rates between San Francisco and Houston?,True
atis_ground_service,Are taxi facilities provided within the premises of Ontario landing field?,True
atis_ground_service,What are the options for traveling around Las Vegas?,True
atis_ground_service,What are the various ways that I can reach central NYC from LGA airport?,True
atis_abbreviation,Any ideas regarding the interpretation of F in fare coding?,True
atis_ground_service,Which forms of conveyance will get me from DCA to the city center of Washington?,True
atis_airfare,How much do I need to pay for a round trip journey onboard TWA when flying from Columbus to St. Louis?,True
atis_ground_service,Which options exist for moving around Baltimore?,True
atis_flight,Which departures exist from Cincinnati to Tampa during the morning?,True
atis_airfare,How much money is needed for a flight between Boston and Washington DC?,True
atis_flight,By what time should I reach the airport in Oakland if I have to go to Salt Lake City on Wednesday?,True
atis_ground_service,How can one travel towards the city center after arriving in the Sin City via an airplane?,True
atis_airfare,Demonstrate the lowest-priced travel expense for a solo voyage beginning at San Francisco and bound for Houston specifically on the twenty-eighth day of February in the year nineteen hundred ninety-four.,True
atis_abbreviation,Could you shed some light on AP 57?,True
atis_flight,Can you provide me with a schedule of air travel options departing Atlanta and ultimately arriving in Toronto on Friday afternoon?,True
atis_ground_service,Can you present options for traveling in Houston on Monday afternoon?,True
atis_abbreviation,Can you shed light on the definition of q?,True
atis_ground_service,Can I get around in St. Louis without flying or boating? ,True
atis_airfare,Can you tell me how much it costs to travel from Miami to Cleveland next Sunday?,True
atis_airfare,What is the expense of a foremost trip from Detroit to Las Vegas plus return?,True
atis_flight,Kindly provide a record of the air travel options between Newark and Los Angeles.,True
atis_airline,Identify the aircrafts operating routes between Detroit and Westchester County.,True
atis_aircraft,"The American departure set to take off at 4:19 PM, what form of transport will be utilized?",True
atis_flight,What are the different itineraries traversing from Dallas to San Francisco that you can share?,True
atis_flight,What is the last available time to travel from Houston to Dallas by night?,True
atis_abbreviation,What's the interpretation of ua? ,True
atis_airline,List the air transport services for travel between Washington DC and Columbus Ohio.,True
atis_airfare,"What is the cost of round-trip travel from San Francisco to Houston on February 28th, 1994 that is budget-friendly?",True
atis_flight,Can you provide me with an air travel from the city that never sleeps to a major US metropolitan area in June?,True
atis_ground_service,What are the alternatives for commuting from PHX terminal to Phoenix's central district?,True
atis_ground_service,It is necessary for me to obtain means of conveyance whilst in Washington D.C.,True
atis_ground_service,What are some viable ways to travel from Charlotte airfield to downtown Charlotte?,True
atis_airfare,I am looking for information about round-trip first-class flights between Indianapolis and Memphis.,True
atis_aircraft,What can you share about the M80 transportation device?,True
atis_airline,What flight company equals another?,True
atis_abbreviation,Could you provide information regarding the significance of ap 20?,True
atis_flight,Explore the prospects of reaching DTW from Milwaukee using air travel.,True
atis_abbreviation,What's the definition of cvg?,True
atis_flight,What are the available schedules from LA to Pittsburgh departing on Tuesday?,True
atis_airfare,Is it possible to go from Pittsburgh to Cleveland without spending over $200?,True
atis_abbreviation,The associated course for fare q?,True
atis_flight,What are the departure options from Indianapolis to reach Montreal in the morning on April 13th?,True
atis_flight,Is it feasible for me to schedule an airplane voyage from LA to Charlotte in the early hours of the day?,True
atis_airfare,What is the cost of a round trip travel in top-tier accommodation from Detroit to St. Petersburg?,True
atis_airfare,Can you tell me the cost of traveling on a Saturday from Washington to Toronto? ,True
atis_abbreviation,What category does the q fare belong to?,True
atis_airfare,What is the expense of going from Miami to Cleveland on the upcoming Sunday?,True
atis_ground_service,How can one get from the airfield to their destination in Indy?,True
atis_airfare,Can you provide information about the cost of traveling from Washington to Montreal on a Saturday?,True
atis_airfare,Could you tell me the cost I should expect to pay for traveling back and forth between Detroit and St. Petersburg with first-class accommodations on an airplane?,True
atis_airline,"What flights are available to travel from Toronto to Detroit, then Detroit to St. Louis, and finally back to Toronto?",True
atis_airfare,How much would it take to travel on a Saturday from Washington to Toronto?,True
atis_flight,"Seeking transportation alternatives for a trip between San Francisco and San Diego, any insights?",True
atis_airfare,What are the charges for transportation from Washington DC to Toronto that would be reasonable?,True
atis_abbreviation,Can you provide information about the significance of 73s?,True
atis_abbreviation,Can you elaborate on the definition of d9s?,True
atis_airline,What's the American aviation company called?,True
atis_abbreviation,What's the significance of ap 20?,True
atis_flight,"What are the available options for travel from Washington D.C. to Columbus, Ohio?",True
atis_airfare,What is the cost of traveling between Washington and Montreal on a Saturday?,True
atis_ground_service,What options exist for moving around Denver on solid surfaces?,True
atis_airfare,How much does it cost for a single trip from Detroit to Westchester County at its highest price point?,True
atis_airfare,How much does it cost for a coach trip traveling from Pittsburgh to Atlanta?,True
atis_aircraft,Please enlighten me about the class of mechanical bird commonly referred to as M80s?,True
atis_airfare,What are the costs for a trip from Cleveland to Miami and back on the next Wednesday?,True
atis_flight,What are the transportation options available for getting from New York to Las Vegas on a Sunday afternoon?,True
atis_airline,Identify the air transportation service that belongs to the US.,True
atis_ground_service,Is there any way to move around while in St. Louis?,True
atis_ground_service,What are the modes of travel within Baltimore?,True
atis_airfare,What is the expense of going to Boston from Washington?,True
atis_ground_service,What modes of conveyance are there in Westchester County to move from place to place?,True
atis_ground_service,Can one get a ride from the byplane station in Denver?,True
atis_abbreviation,What details can you offer regarding fare classification letter m?,True
