intent,text,no_taboo_words
qa_currency,What is the current value equivalence of US dollar and Japanese yen?,True
play_music,"I want to access the most recent compilation of songs by Bob Dylan, could you assist me in doing so?",True
audio_volume_up,Would you mind amplifying the audio?,True
transport_traffic,Can you provide an update on my daily trip?,True
transport_traffic,What is the level of density in vehicles during my commute?,True
news_query,What is the current status of President Trump's travel restriction policy?,True
music_query,Can you identify the person crooning?,True
audio_volume_down,Could you hush the noise level?,True
qa_currency,In what form do people pay for things in England?,True
news_query,Can you provide me with any recent information regarding Trump's travel ban?,True
datetime_query,"The right now situation in NYC, can you provide an update?",True
audio_volume_down,Is it possible to moderate the audio amplitude to half of what it currently is?,True
transport_traffic,Are you able to reach the workplace without facing any blockades during your journey?,True
qa_currency,What is the value of five hundred Mexican pesos?,True
cooking_recipe,The meal has caught my attention and I wish to prepare it.,True
news_query,Is there something worth discussing that unfolded in the early hours of today?,True
music_query,Mention the person responsible for the vocals.,True
music_query,Can you provide me with information regarding the current track?,True
audio_volume_up,I need you to set the audio output precisely to twenty one.,True
audio_volume_up,Would it be okay to amplify the sound to its highest level?,True
audio_volume_down,Could you speak in a softer tone?,True
cooking_recipe,"Robot, could you furnish me with a record of what I require to prepare Welsh Rarebit?",True
music_query,Could you help me discover the melody currently being heard?,True
datetime_query,Can you tell me how far Dakar is temporally from our current location?,True
play_music,"Begin playing songs, starting with the first track.",True
news_query,Would it be possible for you to tell me what’s been occurring locally lately? ,True
datetime_query,What is the interval between this place and Dakar?,True
weather_query,Could the heavens grace us with some icy particles during the course of this week?,True
audio_volume_up,"""I'm having trouble perceiving the sounds you're producing.""",True
datetime_query,Can you tell me how long has it been since dawn in Windy City?,True
cooking_recipe,Can you tell me the steps to make that meal?,True
datetime_query,What's the present moment in Germany?,True
cooking_recipe,How high should the thermostat be when baking cookies?,True
cooking_recipe,At what heat level does one roast potatoes most effectively in an oven?,True
datetime_query,Could you tell me the present moment in New York City?,True
datetime_query,How many hours separate here from Dakar?,True
audio_volume_up,Is it possible to enhance the audio's resonance?,True
weather_query,What can I expect in terms of atmospheric conditions for Barcelona two days from now? ,True
news_query,Could you tell me about the current events today? ,True
cooking_recipe,How can one prepare savory meatballs at home?,True
audio_volume_down,Regulate media noise to an acceptable extent.,True
transport_traffic,How is the flow of vehicles at present?,True
cooking_recipe,How can I make a dish in the kitchen?,True
audio_volume_up,Can you make the sound as audible as possible?,True
transport_traffic,Can you describe the present state of transportation?,True
transport_traffic,What is the status of my travel journey?,True
weather_query,Is the sky going to pour down on us soon? ,True
cooking_recipe,How can I prepare that dish?,True
datetime_query,What's the duration between now and the last sunset in Chicago?,True
transport_traffic,Is there a disturbance hindering the movement of commuters?,True
cooking_recipe,What temperature should be set on the oven for roasting potatoes perfectly?,True
weather_query,How would you describe the overall atmospherics and environmental situation expected in Barcelona after 48 hours? ,True
datetime_query,Can you inform me of the present hour?,True
qa_currency,How does the value of lera differ from that of dollar?,True
transport_traffic,Is it easy to get to the job location without any impediments?,True
weather_query,Can we expect any flurry of white crystals in the coming days?,True
qa_currency,What is the ratio between pound sterling and US dollar value?,True
play_music,Initiate the performance of the soundtrack featured in 'Titanic's title sequence.,True
news_query,Has there been any recent activity on Facebook?,True
qa_currency,Which monetary system is prevalent in England?,True
music_query,What details are currently accessible about the playing composition?,True
weather_query,Will it be beneficial to bring an overhead carrier?,True
cooking_recipe,"Can you provide a rundown of the components needed for preparing Welsh Rarebit, robot?",True
play_music,"I'm in the mood for some melodies that are featured in Titanic, would you be able to provide them?",True
weather_query,"What's the state of precipitation in New Brighton, PA?",True
transport_traffic,How is the movement of vehicles at this moment?,True
audio_volume_up,Can you make the sound louder?,True
news_query,What is currently taking place in the capitol building?,True
transport_traffic,Can you provide information on the present movement status?,True
audio_volume_down,Is it possible for you to speak in a gentler tone?,True
cooking_recipe,What is the suitable heat setting for preparing an entire turkey by frying?,True
audio_volume_down,Alter the acoustic level?,True
music_query,During which year did this specific auditory creation first emerge?,True
play_music,Could you please commence the Titanic soundtrack?,True
weather_query,I'm wondering if you have any insights on what the sky will look like tomorrow.,True
weather_query,Are we in for a wet day today? ,True
news_query,"I'm interested in receiving any information regarding Donald Trump, can you assist me with that?",True
audio_volume_up,Would you mind amplifying the acoustic strength?,True
cooking_recipe,What is the ultimate way to prepare meatballs?,True
qa_currency,What form of money is commonly used in Egypt?,True
play_music,It's time to let the melodies of the Beatles fill our ears and hearts with joy.,True
news_query,Has there been any change with the Sweden bombing occurrence?,True
news_query,Have they cast any vote on the budget yet?,True
audio_volume_up,Would it be possible for you to enhance the auditory experience?,True
audio_volume_down,Would it be okay to use a more restrained vocal pitch?,True
news_query,What are the recent developments within the city that I should be aware of?,True
music_query,Identify the vocalist.,True
music_query,What data is available for the current track?,True
music_query,Which type of melody captivates my ears frequently?,True
play_music,"Is it possible for you to stream ""Let Me Love You"" sung by Ariana Grande?",True
news_query,What is the current status of Trump's restriction on travel?,True
qa_currency,What is the equivalent value of yen?,True
news_query,What activities are taking place in the capitol?,True
cooking_recipe,What methods exist to create an edible meal?,True
weather_query,Do I require my sunnies for today's brightness?,True
news_query,Is there any development in the Sweden bombing incident?,True
music_query,What are my preferences when it comes to the audio I enjoy?,True
transport_traffic,Can you describe the situation on the thoroughfare currently?,True
weather_query,"If there's moisture in the air, is it wise to not attend work? ",True
datetime_query,Can you tell me the present moment's status within New York City?,True
datetime_query,When will Wednesday of the coming week arrive?,True
qa_currency,"In Egypt, how do individuals make transactions?",True
play_music,"If some music from Cat Stevens is present, my joy will be immense.",True
cooking_recipe,What temperature must be set for frying a whole turkey?,True
audio_volume_up,"""I need you to project your words more distinctly.""",True
qa_currency,In what way do individuals pay for goods and services in Egypt?,True
qa_currency,What is the relativity between the lera and the dollar?,True
music_query,By whom was that melody created?,True
cooking_recipe,What are some ways I can prepare food?,True
audio_volume_up,"Is it possible to enhance the auditory experience, please?",True
weather_query,Can you inform me about the expected atmospheric conditions for tomorrow?,True
news_query,What's been going on around here lately that I should know about?,True
play_music,Is it possible for you to access the collection of melodies I've compiled?,True
transport_traffic,Are there any bothersome hurdles while taking the 101?,True
weather_query,Kindly display the atmospheric outlook for the following week's first business day.,True
news_query,Are there any fresh details about the bombing event in Sweden?,True
audio_volume_down,Is it possible to soften the audio emanating from the speaker system?,True
weather_query,Is it necessary for me to prepare to dig the path from my home?,True
datetime_query,Can you tell me the present hour in Ivory Coast?,True
news_query,Can you tell me about the present situation at the Capitol Hill?,True
audio_volume_up,Is it possible to amplify the sound waves?,True
weather_query,I require details about how it will be outside this coming Monday.,True
qa_currency,How much purchasing power does five hundred pesos have?,True
weather_query,The presence of wetness in the atmosphere will prevent me from carrying out my professional duties.,True
transport_traffic,Any updates on the current network situation?,True
transport_traffic,Are there any obstructions causing delays?,True
datetime_query,What is the present hour?,True
datetime_query,Investigate to discover the current region-specific timing information.,True
news_query,Can you tell me about the most recent developments within our locality?,True
audio_volume_up,The need is for amplification of sound waves.,True
audio_volume_up,Boost the sound emanating from the left-sided speaker by ten units.,True
play_music,Who's entertaining the audience at the moment?,True
news_query,I'm curious to know what's been going on with Donald Trump lately. Could you give me some insight?,True
qa_currency,How does the purchasing power of a pound sterling compare to that of the US dollar?,True
qa_currency,How much can be bought with a dollar in rupees in India? ,True
weather_query,"Should water fall from the sky, my daily labor will be postponed.",True
qa_currency,What is the value of pounds when compared to dollars?,True
transport_traffic,Can you describe the quality of my daily journey?,True
cooking_recipe,How warm should my oven be for baking cookies?,True
audio_volume_down,Reduce the loudness emitted from the audio device.,True
datetime_query,What's the current hour in New York City?,True
news_query,Can you provide me with information concerning the city's current affairs? ,True
music_query,Is it possible to recognize what's playing at the moment?,True
music_query,Whose work is that arrangement?,True
weather_query,Can you provide an overview of what the general outdoors atmosphere might feel like in Barcelona two days hence?,True
datetime_query,How do we measure the duration of an event?,True
datetime_query,"As humans, how do we quantify the past, present and future?",True
audio_volume_down,Muffle the speaker's voice amplitude.,True
audio_volume_up,Amplify the output of the left speaker by ten notches.,True
transport_traffic,What was your experience with the transportation situation presently?,True
music_query,Can you send me the words from that sound file through an electronic message? ,True
play_music,Kindly broadcast the tunes that I prefer.,True
play_music,Could you provide a way to enjoy the newest compilation of Bob Dylan's tunes?,True
audio_volume_down,It would be great if you could make some adjustment to the sound level.,True
qa_currency,What's the value of five hundred pesos?,True
weather_query,Is there any chance of seeing some snow before the week ends?,True
audio_volume_up,Could you adjust the sound to level twenty one?,True
weather_query,How's the sky looking like in New Brighton PA?,True
news_query,Which topics are being talked about the most at the moment?,True
weather_query,Can you display the atmospheric conditions for Monday?,True
audio_volume_down,Can you make the sound less intense?,True
datetime_query,What is the existing moment in Germany?,True
music_query,Can you figure out what's playing right now?,True
audio_volume_down,Can you reduce the sound level by fifty percent?,True
audio_volume_up,"I'm having trouble hearing, can you make it more audible?",True
music_query,Is it possible for you to dispatch the lyrical composition to my email?,True
audio_volume_up,Would it be possible for you to adjust the level of the sound till 21 on the dial?,True
weather_query,Should I consider making arrangements to remove obstacles around my residence?,True
audio_volume_down,Can you make the sound less loud?,True
audio_volume_up,Amplify the auditory output.,True
cooking_recipe,How can one determine the precise temperature to use when deep-frying a full bird?,True
audio_volume_down,Reduce the loudness of media-related sounds.,True
play_music,Can you put on some tunes that I've picked out?,True
qa_currency,"Five hundred Mexican pesos, what is its equivalent?",True
cooking_recipe,How can one concoct delectable spheres of minced meat?,True
news_query,"""What is the most recent event or incident locally worth being informed about?""",True
datetime_query,What's the momentary position of the minute hand?,True
cooking_recipe,Can you demonstrate how to make a batch of cookies from scratch?,True
play_music,"Would it be possible for you to put on the song ""Let Me Love You"" sung by Ariana Grande?",True
weather_query,"In case precipitation occurs, I will abstain from working.",True
cooking_recipe,What is the secret to making mouth-watering balls of ground meat?,True
cooking_recipe,"Hey robot, can you grant me a catalog of elements needed for Welsh Rarebit?",True
transport_traffic,What's the situation like with vehicles traveling down the freeway?,True
transport_traffic,Can you describe the state of mobility right now?,True
music_query,Can you inform me about my melodic taste?,True
play_music,Let's get down to some funky beats!,True
qa_currency,How does the lera stack up against the dollar?,True
datetime_query,When should I tune into an event being broadcasted in the Midwest's urban gem?,True
play_music,Could you set up the fresh Bob Dylan music collection?,True
play_music,Is it possible to enjoy listening to the main track of Titanic?,True
news_query,Have the authorities taken any decisions on the budget's ratification?,True
weather_query,Should I pack my sunglasses for today's outing?,True
transport_traffic,How was the flow of vehicles at the current moment?,True
weather_query,Do you think I should bring my sunglasses with me today?,True
transport_traffic,What is my travel experience like?,True
weather_query,Are we expecting any frozen precipitation within the next few sunrises and sunsets?,True
cooking_recipe,What should be the temperature reading before putting cookies in the oven?,True
qa_currency,What is the ratio of U.S. dollars to Indian rupees?,True
audio_volume_up,I require an elevated intensity level.,True
datetime_query,Give me information about the existing instant in Germany.,True
play_music,Which artist do you recommend me turning on?,True
transport_traffic,"""What are the chances of experiencing traffic-related disruption during my daily route?""",True
news_query,Is there anything noteworthy that took place in our vicinity that I should be aware of?,True
music_query,Do you recognize the vocalist behind the mic?,True
music_query,Do I have your permission to receive the wording associated with this arrangement electronically?,True
transport_traffic,Is the flow of vehicles halted at any point?,True
play_music,Can you tune in to the songs I have curated?,True
weather_query,Is it necessary for me to prepare for digging a path out of my home?,True
audio_volume_down,"Can we have a little less noise, please?",True
audio_volume_down,Reduce the level of sound.,True
audio_volume_up,Is it possible to enhance the audio decibel level?,True
qa_currency,What is the value of one American dollar in Indian rupees? ,True
transport_traffic,Can you provide an update on the present state of the thoroughfares?,True
music_query,When did this particular tune make its debut?,True
audio_volume_up,Can you enhance the audio output?,True
audio_volume_up,Enhance the amplitude of the speaker on the left side by 10.,True
datetime_query,Can you describe the measurement of duration?,True
news_query,Is there anything fresh or novel happening on Facebook?,True
cooking_recipe,Investigate methods of making a four-cheese omelette.,True
