intent,text
weather_query,Would you mind providing details regarding the climate outlook for the beginning of next week?
weather_query,Is it necessary for me to prepare for clearing a path out of my home?
weather_query,Would it be wise for me to anticipate creating an exit strategy that involves shoveling?
weather_query,Do I need to think ahead and organize a method to dig myself out of the house?
weather_query,Is it wise to make arrangements to clear the pathway from my home? 
weather_query,Would it be sensible to have a strategy in place for removing snow around my house?
weather_query,Do you think it would be practical to prepare for clearing the area surrounding my residence?
qa_currency,How many US dollars would equal the value of a calone?
qa_currency,"In terms of worth, how does a calone compare to a US dollar?"
qa_currency,What is the relative value of a calone when compared to a US dollar?
qa_currency,How much is a calone valued in comparison to the American dollar?
qa_currency,"In relation to the US dollar, what is the worth of a calone?"
qa_currency,What would be the equivalent value of a calone when compared to the US dollar?
qa_currency,What is the equivalent value of five hundred pesos?
qa_currency,How valuable are five hundred pesos?
qa_currency,What is the worth of five hundred pesos?
qa_currency,What is the value of five hundred pesos?
qa_currency,How much purchasing power does five hundred pesos have?
qa_currency,What can be bought with five hundred pesos?
qa_currency,How much would a dollar be worth in pounds sterling?
qa_currency,What is the relative value of pound sterling compared to US dollars?
qa_currency,What quantity of pounds and dollars have matching values in cross-border transactions?
qa_currency,How much would I get for a pound in US dollars?
qa_currency,What is the price ratio of pound sterling to the American dollar?
qa_currency,Can you tell me the equivalent value of one unit of pound sterling compared to the us dollar?
qa_currency,Change US money to British pounds.
qa_currency,Transform dollars into sterling.
qa_currency,Convert greenbacks to quid.
qa_currency,How can I change my US money to UK currency?
qa_currency,What's the procedure for converting dollars into pounds?
qa_currency,Is there a way to transform American dollars into British pounds?
qa_currency,How does the value of the lera differ from that of the dollar?
qa_currency,"In terms of worth, how does the lera stack up against the dollar?"
qa_currency,What is the relative value of the lera compared to the dollar?
qa_currency,How does the worth of lera stack up against that of the dollar?
qa_currency,
qa_currency,"In terms of value, how do the dollar and lera compare with one another?"
qa_currency,
qa_currency,What is the relation between the values of the dollar and lera?
qa_currency,What is the value of one American unit in Indian denomination?
qa_currency,How much does an Indian rupee cost as compared to a US dollar?
qa_currency,Can you tell me the rate at which money can be converted from US dollars to Indian rupees?
qa_currency,"""How many Indian rupees does one American dollar translate to?"""
qa_currency,"""What's the conversion rate for USD and INR in current times?"""
qa_currency,"""What amount of INR would someone get in return for their USD?"""
qa_currency,What type of denomination is commonly used in Egypt for business transactions?
qa_currency,"In Egypt, what unit of value do people utilize to buy and sell goods?"
qa_currency,"When purchasing goods or services in Egypt, what form of money is typically used?"
qa_currency,What monetary unit does Egypt use?
qa_currency,What type of money is accepted in Egypt?
qa_currency,What do people use to pay for goods and services in Egypt?
qa_currency,What is the current value of the yen in comparison to other units of measurement?
qa_currency,Can you provide me with an update on the worth of the Japanese money?
qa_currency,"I'm curious about the equivalency of yen to other forms of legal tender, would you happen to know?"
qa_currency,What is the current worth of yen in dollars?
qa_currency,How many US dollars can I get for some yen?
qa_currency,Can you inform me about the value of yen when converted to US currency?
qa_currency,What type of legal tender is accepted in England?
qa_currency,In what form do you need to pay for goods and services in England?
qa_currency,What is the monetary unit used in England?
qa_currency,What kind of money is commonly seen in England?
qa_currency,Which type of cash do people usually handle in England?
qa_currency,In what form do monetary transactions occur in England?
qa_currency,Can you tell me how much one U.S. Dollar is worth in Japanese Yen?
qa_currency,What's the value of United States currency compared to Japanese money?
qa_currency,Could you provide information on the equivalence of American dollars and Japanese yen?
qa_currency,What is the conversion rate currently being used for US dollars to Japanese yen? 
qa_currency,Could you inform me of the current worth of American currency in Japanese yen? 
qa_currency,Can you provide information on how much one can get in Japanese yen by trading United States dollars at present?
play_music,Can you start playing the songs from the Titanic?
play_music,"Commence the playback of music from the movie ""Titanic."""
play_music,"Begin performing the melodies featured in the film ""Titanic."""
play_music,Could you please start playing the songs from the movie Titanic?
play_music,"I'd like to hear some tunes from Titanic, can you get them playing?"
play_music,How about some music from the legendary movie Titanic?
play_music,Can you stream the theme song of Titanic?
play_music,Is it possible to hear the iconic tune from Titanic?
play_music,Could you play the memorable melody of Titanic's opening credits?
play_music,Can you hit the play button on the Titanic's theme song?
play_music,Could you play the title track from Titanic?
play_music,Would you mind playing the song that appears in the opening credits of Titanic?
play_music,"If you could put on a Cat Stevens track, it would really brighten my day."
play_music,My day would greatly improve if you played any song by Cat Stevens.
play_music,Hearing some tunes from Cat Stevens would definitely make me happy.
play_music,"If you happen to play a Cat Stevens song, my day would suddenly become brighter."
play_music,Playing any tune by Cat Stevens would bring me immense joy and satisfaction.
play_music,All it takes is one simple act of playing a music piece from Cat Stevens' collection to make my day.
play_music,Can you stream some melodies from the Beatles?
play_music,"Is it possible for you to blast some tunes created by the band, The Beatles? "
play_music,Any chance you could spin a few tracks produced by The Fab Four?
play_music,Can you put on some Beatles tunes?
play_music,How about we have some music by The Beatles playing?
play_music,Would you mind playing some of The Beatles' songs?
play_music,Initiate the playlist commencing at the first song.
play_music,"Commence playing the playlist, beginning with the initial track."
play_music,Launch the playlist and start with the very first song in it.
play_music,Begin playing the first song on the playlist.
play_music,Commence the playlist with the initial track.
play_music,Trigger the playlist to start from the very first tune.
play_music,Can you put on some groovy funk tunes?
play_music,How about some upbeat and rhythmic funk melodies to enjoy?
play_music,Do you feel like jamming out to some funky music in the background?
play_music,Can you put on some funky tunes?
play_music,Do you have any music that has a funk sound to it?
play_music,How about we jam out to some groovy beats?
play_music,Could you shuffle the latest Bob Dylan playlist for me to enjoy?
play_music,Please hit play on Bob Dylan's most recent song collection.
play_music,I'm in the mood for some fresh Bob Dylan tunes; can you start his latest playlist?
play_music,Could you please let me hear the most recent compilation of Bob Dylan songs?
play_music,Is it possible for me to experience the latest set of tracks from Bob Dylan's playlist?
play_music,Can you assist me in playing the freshest Bob Dylan playlist?
play_music,"Can you please start ""Let Me Love You"" by Ariana Grande?"
play_music,"I'd appreciate if you could play Ariana Grande's ""Let Me Love You""."
play_music,"It would be great if you could put on the song ""Let Me Love You"" sung by Ariana Grande."
play_music,"Can you hit the play button for ""Let Me Love You"" by Ariana Grande?"
play_music,"Put on the song ""Let Me Love You"" by Ariana Grande please."
play_music,"Could you start playing ""Let Me Love You"" sung by Ariana Grande?"
play_music,Can you kindly put on tracks from my compilation of songs?
play_music,Would you mind streaming the music collection I've curated?
play_music,Could you play back tunes in the playlist I've created?
play_music,Kindly put some music on from the song list I have.
play_music,"Could you select and play tunes that are in my musical collection, please?"
play_music,I would love to hear tracks from the playlist I have selected; could you play them for me?
play_music,What is the option for choosing a specific artist to hear their music?
play_music,How can I select an individual musician's work to enjoy it?
play_music,Is there a way to directly access and play songs by my favorite artist?
play_music,Who is the performing artist?
play_music,Which musician is currently on stage?
play_music,What artist is projecting their music?
transport_traffic,What is the expected duration for commuting to work?
transport_traffic,The length of time it takes to get to work?
transport_traffic,What is the average time needed for traveling to one's workplace?
transport_traffic,What is the expected length of time it takes for one to commute to work?
transport_traffic,How much time ought a person spend traveling to their place of business?
transport_traffic,What is an appropriate duration for the journey to one's workplace?
transport_traffic,Is there any obstruction in transit?
transport_traffic,Are vehicles experiencing holdups?
transport_traffic,Does transportation encounter any impediments?
transport_traffic,Is there any congestion on the road?
transport_traffic,Are there any slowdowns or stops ahead?
transport_traffic,Are there any obstructions or hurdles that could hinder my path?
transport_traffic,What is the volume of vehicles on Highway 101?
transport_traffic,Is there congestion or ease of movement on route one-zero-one?
transport_traffic,How heavy or light is the flow of cars on the 101?
transport_traffic,How fast is the movement on the 101 freeway?
transport_traffic,Is the flow of vehicles on the one hundred and one highway congested?
transport_traffic,Can you inform me about the transit status of the road labeled as the one-oh-one?
transport_traffic,What is the level of congestion on my commuting route?
transport_traffic,Is my route to work heavily congested?
transport_traffic,How much traffic do I encounter during my daily commute?
transport_traffic,What is the level of obstruction I can expect on my commute to work?
transport_traffic,Will the pathway to my workplace be obstructed with excess vehicles?
transport_traffic,Are there any hindrances that can cause delay in reaching my office?
transport_traffic,What's the current state of the roads?
transport_traffic,Can you provide an update on the condition of the roadways at present?
transport_traffic,How would you describe the overall appearance of the roads presently?
transport_traffic,What is the current state of the thoroughfares?
transport_traffic,Can you give me an update on the condition of the pathways at the moment?
transport_traffic,How do the streets appear presently?
transport_traffic,How was the flow of cars recently?
transport_traffic,Did you encounter any congestion on your way?
transport_traffic,Was there any obstruction on the road during your commute?
transport_traffic,What was the flow of vehicles like at the moment?
transport_traffic,How was the movement on the roads lately?
transport_traffic,Was there any congestion in the vicinity recently?
transport_traffic,Can you provide me with an update on the current state of vehicular movement?
transport_traffic,How is the present situation on the roads pertaining to the volume of vehicles?
transport_traffic,Could you let me know how free-flowing the transportation network is right now?
transport_traffic,What is the current situation on the road?
transport_traffic,Can you tell me how smooth or congested the streets are right now?
transport_traffic,Is there anything noteworthy about the present state of vehicular movement?
transport_traffic,What is the current state of vehicular movement?
transport_traffic,How is the flow of automobiles at present?
transport_traffic,Can you provide insights on the present status of the roads?
transport_traffic,What is the current state of vehicular movement?
transport_traffic,How's the road condition at present?
transport_traffic,Is there any congestion on the streets currently?
transport_traffic,"""Is the route to work unobstructed?"""
transport_traffic,"""Can I smoothly make my way to work?"""
transport_traffic,"""Does it look like there will be any impediments on my commute?"""
transport_traffic,Are the roads to work open?
transport_traffic,Is there any hindrance on the way to work?
transport_traffic,How is the commute to work?
transport_traffic,What is my journey to work like?
transport_traffic,Can you describe the experience of traveling to my workplace?
transport_traffic,How is the distance from my home to office?
transport_traffic,What's the status of my transportation to work?
transport_traffic,Has the journey to my workplace been smooth lately?
transport_traffic,Is there anything noteworthy about my daily route to the office?
music_query,Can you tell me the tune that's currently on?
music_query,What's the music that's playing right now?
music_query,Do you know the current melody being aired?
music_query,Can you help me identify the tune that's playing right now?
music_query,Is it possible for you to fetch me the melody presently being performed?
music_query,Could you assist me in locating the music currently resonating?
music_query,Which genre of music do I tend to listen to the most?
music_query,What kind of music genre dominates my listening habits?
music_query,Which category of music occupies most of my listening time?
music_query,Which type of music do I prefer listening to the most?
music_query,What genre of music is my top pick to listen to?
music_query,What kind of music draws me in the most?
music_query,Can you tell me the person or band that performed this particular melody?
music_query,I'm keen to know the name of the artist who created this tune. 
music_query,Could you inform me of the musician responsible for this piece of music?
music_query,What is the artist behind that tune?
music_query,Whose voice can be heard in that melody?
music_query,Who composed and arranged that music piece?
music_query,Can you send me the words of this musical composition over email?
music_query,Could you please forward the lyrical content of this audio track to my inbox?
music_query,Is it possible for you to transmit the textual representation of this sound recording via electronic mail?
music_query,Can I receive the words of this melody via email?
music_query,Would it be possible for me to have the lyrical content sent through an electronic message?
music_query,Is there a way for you to send me the song's lyrics via email?
music_query,Can you provide me with details about the current music being played?
music_query,Do you have any intel regarding the melody currently on air?
music_query,Could you furnish me with information about the track that's currently streaming?
music_query,Can you provide details regarding the melody that's currently audible?
music_query,What do you know about the tune being played right now?
music_query,Could you furnish me with some insights on the music playing at the moment?
music_query,Can you inform me about my musical taste? 
music_query,What's the genre of my preferred tracks?
music_query,Could you reveal to me my favored kind of music?
music_query,What are my preferred musical genres? 
music_query,Can you enlighten me on what sort of music I'm interested in? 
music_query,May I know the type of music that strikes a chord with me?
music_query,Who is the person performing the music?
music_query,Identify the vocalist.
music_query,What is the name of the individual providing vocals?
music_query,Who is the individual performing the music piece?
music_query,"The vocalist responsible for the musical masterpiece, do you know his/her moniker? "
music_query,"Identifying the person lending their voice to this particular composition, what's his or her identity?"
music_query,In which year was this particular music piece released to the public?
music_query,At what time did this melody first become known to audiences?
music_query,When was this track initially made available for listening?
music_query,In what year was this music track premiered?
music_query,On which year was this melody released?
music_query,What is the year of the origin of this sound recording?
music_query,Can you identify the music that is currently being played?
music_query,What is the title of the melody playing right now?
music_query,Could you help me locate the tune that's presently on air?
music_query,Can you search for the music currently being played?
music_query,Identify the track that's presently on.
music_query,Locate the melody that is playing at the moment.
music_query,What details about the music can be provided at this moment?
music_query,Could you provide me with the current information regarding the soundtrack?
music_query,What do you currently know about the track details?
music_query,"""What details can you provide about the current music playing?"""
music_query,"""Could you share the specifics of the current track being played?"""
music_query,"""What are the relevant details regarding the currently playing audio?"""
