intent,text
cooking_recipe,Can you display the instructions on how to make cookies?
cooking_recipe,Please reveal the method for baking cookies.
cooking_recipe,Is it possible for you to share the steps in creating a batch of cookies?
cooking_recipe,Can you display the process to make cookies?
cooking_recipe,I'd like to see the instructions for creating cookies.
cooking_recipe,What are the steps involved in baking delicious cookies?
cooking_recipe,What is the ideal temperature for baking cookies?
cooking_recipe,At what degree should I set my oven to bake cookies?
cooking_recipe,What temperature range works best for making baked cookies?
cooking_recipe,What's the ideal oven temperature for baking cookies?
cooking_recipe,Which temperature setting should I choose for cookie baking in my oven?
cooking_recipe,Can you suggest a suitable degree of heat for baking cookies?
cooking_recipe,Can you demonstrate a way to prepare cookies? 
cooking_recipe,How do I make homemade cookies? 
cooking_recipe,Could you provide instructions for baking some cookies?
cooking_recipe,Can you demonstrate how to make some cookies?
cooking_recipe,I'd like to see a step-by-step guide on making chocolate chip treats.
cooking_recipe,Could you walk me through the process of baking a batch of delicious cookies?
cooking_recipe,Determine the optimal temperature for cooking an entire turkey in hot oil.
cooking_recipe,Discover the precise heat required to fry a complete turkey.
cooking_recipe,Ascertain the suitable temperature to use when frying a whole bird.
cooking_recipe,What is the ideal frying temperature for a whole turkey?
cooking_recipe,How can you determine the appropriate heat level when deep-frying a whole turkey? 
cooking_recipe,"In order to avoid undercooked or overcooked meat, what temperature should you aim for when frying an entire turkey?"
cooking_recipe,What is the ultimate way to make tasty meatballs? 
cooking_recipe,How can you create the perfect savory meatball dish?
cooking_recipe,What are some techniques to prepare mouth-watering meatballs?
cooking_recipe,What is the most excellent way to prepare meatballs?
cooking_recipe,How can I make delicious meatballs?
cooking_recipe,Which method is the top choice for crafting a tasty meatball dish?
cooking_recipe,Which oven temperature yields perfectly roasted potatoes?
cooking_recipe,What's the ideal heat level for roasting potatoes in an oven?
cooking_recipe,At what temperature should you bake your potatoes to achieve the optimal roast?
cooking_recipe,"""What temperature setting should the oven be for optimal potato roasting?"""
cooking_recipe,"""At what degree should I set my oven to perfectly roast potatoes?"""
cooking_recipe,"""What's the ideal temperature to attain crispy and golden-brown potatoes in the oven?"""
cooking_recipe,Find ideas on how to make a four-cheese omelette.
cooking_recipe,Hunt for ways of preparing a delectable four-cheese omelet.
cooking_recipe,Search for options for cooking a mouth-watering meal of four cheeses and eggs mixed together.
cooking_recipe,Search for instructions on how to prepare omelette with four kinds of cheese.
cooking_recipe,Find some guidance on making an omelette containing four different cheeses.
cooking_recipe,Seek out methods for preparing an omelette that includes a quartet of distinct types of cheese.
cooking_recipe,"Can you provide me with a rundown of the components needed to make Welsh rarebit, robot?"
cooking_recipe,"Robot, kindly furnish me with a catalogue of ingredients necessary to prepare Welsh rarebit."
cooking_recipe,"Dear robot, would it be possible for you to enumerate the essential elements required for the creation of Welsh rarebit?"
cooking_recipe,"Can you provide me with a catalog of the components required to make welsh rarebit, robot?"
cooking_recipe,"Hey there, robot. Would you be able to furnish me with a rundown of ingredients needed for preparing welsh rarebit dish?"
cooking_recipe,"I am looking for a list of items to whip up welsh rarebit. Could you assist me in this matter, oh wise robot?"
cooking_recipe,I am interested in preparing that dish.
cooking_recipe,My intention is to whip up that particular meal.
cooking_recipe,The meal which I desire to prepare is the one in question.
cooking_recipe,"""I would like to prepare that dish."""
cooking_recipe,"""Cooking that meal sounds appealing to me."""
cooking_recipe,"""My desire is to make that particular cuisine."""
cooking_recipe,What are some ways to prepare a meal?
cooking_recipe,How do I go about cooking a dish?
cooking_recipe,What steps should I follow to make a home-cooked meal?
cooking_recipe,"""What are some ways to prepare a meal from scratch?"""
cooking_recipe,"""How can I whip up a tasty dish without relying on pre-made instructions?"""
cooking_recipe,"""What techniques and methods can I use to create a delicious home-cooked meal?"""
datetime_query,Kindly inform me of the present moment.
datetime_query,Can you share with me what hour it is now?
datetime_query,What is the status of the day's cycle at this time?
datetime_query,Can you let me know what hour it is at the current moment?
datetime_query,Would you provide me with information regarding the present moment's hour? 
datetime_query,Could you inform me of the exact hour of the day?
datetime_query,What is the current period in Chicago right now?
datetime_query,In which temporal setting does Chicago currently exist?
datetime_query,What is the present point worth of Chicago's chronological spectrum?
datetime_query,What is the current hour in Chicago?
datetime_query,Could you tell me what's on the clock tower in Chicago?
datetime_query,Are you familiar with the standard chronometry used in Chicago?
datetime_query,"""What is the measurement of duration in a day?"""
datetime_query,"""How do we mark the passing of moments throughout the day?"""
datetime_query,"""In what way can we keep track of the progression of events within a given period?"""
datetime_query,How do we measure the passing of moments?
datetime_query,In what way can we classify the duration of events?
datetime_query,What is the standard unit to determine the sequence of occurrences?
datetime_query,What hour does the Windy City exhibit?
datetime_query,How many minutes have passed in the town of Chicago?
datetime_query,Can you tell me the moment of the day that is occurring right now in the city of Chicago?
datetime_query,What is the current hour in Chicago?
datetime_query,How much has elapsed since dawn in Chicago?
datetime_query,What is the momentary situation regarding daylight or dusk in Chicago?
datetime_query,Can you tell me what hour it is in Germany at the moment?
datetime_query,I need to know what the current period of the day is in Germany.
datetime_query,Please inform me about the present moment's timing status in Germany.
datetime_query,What is the present moment in Germany?
datetime_query,Can you provide me with the current hour in Germany?
datetime_query,"I would like to know what period of the day it is right now in Germany, could you tell me?"
datetime_query,Locate the present time and regional time variation.
datetime_query,Seek out the existing local timezone information.
datetime_query,Investigate to discover up-to-date area timing details.
datetime_query,What is the present temporal information for my location?
datetime_query,Where can I find the latest details regarding the time zone and schedule in my vicinity?
datetime_query,How do I discover the up-to-date temporal specifics for my current geographical position?
datetime_query,Can you inform me of the current hour in New York City?
datetime_query,What's the present moment for people living in New York City?
datetime_query,Could you tell me about the current timing in the city of New York?
datetime_query,Could you tell me the current hour in New York City?
datetime_query,What's the present moment of the day in New York City?
datetime_query,Do you know what hour it is at the moment in New York City?
datetime_query,What is the present moment in Ivory Coast?
datetime_query,Can you tell me the actual hour in Ivory Coast right now?
datetime_query,How far progressed is the day in Ivory Coast currently?
datetime_query,What is the current hour in Ivory Coast?
datetime_query,Can you tell me what time is it now in Ivory Coast?
datetime_query,"I wonder, at this moment, what hour it is in Ivory Coast?"
datetime_query,How much of a temporal discrepancy exists from this location to Dakar?
datetime_query,What is the variance in timing between here and Dakar?
datetime_query,How much does the hour setting differ between this place and Dakar?
datetime_query,How far apart are the temporal zones of here and Dakar?
datetime_query,What is the discrepancy in temporal measurements between this place and Dakar?
datetime_query,How many ticks of a minute hand must happen to span the time difference from this location to Dakar?
datetime_query,Which weekday will follow Tuesday in the upcoming week?
datetime_query,What is the date of the second day after Tuesday this week?
datetime_query,"When is the next Wednesday, not counting today and tomorrow?"
datetime_query,When will next Wednesday occur?
datetime_query,What day will be observed one week from now?
datetime_query,Which day of the coming week follows Tuesday?
audio_volume_up,Can you adjust the sound level to a higher degree?
audio_volume_up,It would be great if you could enhance the audio strength.
audio_volume_up,Would you mind making the speakers produce more audible sound?
audio_volume_up,Can you make the sound louder?
audio_volume_up,Would it be possible to raise the volume level?
audio_volume_up,Could you enhance the audibility of this rendition?
audio_volume_up,Enhance the volume of the audio.
audio_volume_up,Amplify the auditory experience.
audio_volume_up,Boost the sound level.
audio_volume_up,"Amplify the volume, please."
audio_volume_up,"Make the audio louder, would you?"
audio_volume_up,Adjust the sound to a higher level.
audio_volume_up,Could you make the sound a bit stronger?
audio_volume_up,"I'm having trouble hearing, could you amplify the sound please?"
audio_volume_up,Is it possible for you to enhance the volume a little?
audio_volume_up,Is it possible to enhance the sound's audibility?
audio_volume_up,Could you make the audio more audible?
audio_volume_up,Is there a way to amplify the volume of the sound?
audio_volume_up,I require a substantial level.
audio_volume_up,My need is for a great amplitude.
audio_volume_up,I'm in search of a sizable magnitude.
audio_volume_up,Can you provide me a larger quantity?
audio_volume_up,I require a significant amplification to meet my needs.
audio_volume_up,Is it possible to obtain a substantial surge in capacity?
audio_volume_up,Please adjust the left speaker's sound to be ten parts higher.
audio_volume_up,Can you boost the volume of the speaker on the left by ten units?
audio_volume_up,The audio output from the left speaker needs to be upped by ten levels.
audio_volume_up,Adjust the left speaker's sound level by adding ten.
audio_volume_up,Enhance the amplitude of the audio in the left channel by a factor of ten.
audio_volume_up,Raise the decibel level of the left-side loudspeaker by a margin of ten.
audio_volume_up,Can you elevate the sound level to twenty one?
audio_volume_up,Would it be possible to raise the volume up to twenty one?
audio_volume_up,Could you adjust the audio to a setting of twenty one?
audio_volume_up,Kindly raise the volume level to twenty one.
audio_volume_up,Can you enhance the sound to a value of twenty one?
audio_volume_up,"Would you mind elevating the audio to twenty one, please?"
audio_volume_up,Kindly adjust the volume to its maximum level.
audio_volume_up,Would you give the sound setting a boost and set it at the highest possible volume?
audio_volume_up,Can you kindly raise the volume level to its topmost limit?
audio_volume_up,"Adjust the volume to its maximum level, please."
audio_volume_up,Can you set the volume at the highest point right now?
audio_volume_up,Would it be possible for you to raise the volume to its utmost limit?
audio_volume_up,"Can you raise the audio level, please?"
audio_volume_up,Could you turn up the volume a bit?
audio_volume_up,I'd appreciate if you could make it sound a little bit clearer.
audio_volume_up,Can you turn up the sound a bit?
audio_volume_up,"I'm having trouble hearing, could you make it more audible?"
audio_volume_up,Is there any way to enhance the audio on this?
audio_volume_up,Could you please speak up a bit?
audio_volume_up,"Sorry, your voice is too low for me to catch."
audio_volume_up,Would you mind repeating that louder?
audio_volume_up,"""Your voice is not audible to me."""
audio_volume_up,"""I am unable to perceive any sound from you."""
audio_volume_up,"""There seems to be a problem with the sound transmission, as I cannot hear your voice."""
audio_volume_up,Could you enhance the audio?
audio_volume_up,I'd appreciate it if you could boost the sound level.
audio_volume_up,Can we get more decibels?
audio_volume_up,Could you enhance the sound output?
audio_volume_up,Can you amplify the audio level a bit more?
audio_volume_up,Would it be possible to raise the decibel level?
news_query,What updates are there on the recent bombing in Sweden?
news_query,Is there any fresh information regarding the bomb attack that transpired in Sweden?
news_query,Have there been any significant developments with regards to the recent explosion in Sweden?
news_query,Is there any recent development in the Sweden bombing incident?
news_query,Have there been any updates on the Sweden bombing situation?
news_query,What is the latest information available on the Sweden bombing episode?
news_query,What are the latest popular discussion subjects?
news_query,What is currently generating a buzz in conversations?
news_query,Which topics are grabbing people's attention right now?
news_query,What are the current buzzworthy topics?
news_query,Which subjects are capturing everyone's attention right now?
news_query,What are the most popular conversation starters of the moment?
news_query,What is the latest happening around town?
news_query,Any recent developments within the community's reach?
news_query,Have there been any noteworthy events in the nearby vicinity lately?
news_query,What are the latest developments in the area?
news_query,Are there any recent happenings around this locality?
news_query,Can you inform me about the current events unfolding nearby?
news_query,Can you provide me with current updates related to Donald Trump?
news_query,"I am interested in knowing the latest developments regarding Donald Trump, can you assist me?"
news_query,Could you give me information about what is happening recently in association with Donald Trump?
news_query,Could you provide me with the latest information regarding Donald Trump?
news_query,Can you give me an update about what's happening with Donald Trump?
news_query,"I'm interested in learning more about current developments involving Donald Trump, can you help me out?"
news_query,Has the voting process for the budget concluded?
news_query,Can you confirm if the budget has been approved through voting?
news_query,Is there any update on whether the budget has received a vote of approval?
news_query,"""Has the budget been approved already?"""
news_query,"""When was the voting for the budget held?"""
news_query,"""Is there any update on the decision about the budget?"""
news_query,Can you provide me with the most recent updates regarding the city's happenings?
news_query,"I'm interested in keeping up-to-date on what's currently going on in the city, could you relay that information to me?"
news_query,What are the newest developments around town that I should be aware of?
news_query,Can you tell me what's the latest buzz in our city?
news_query,What are the current happenings in our local community?
news_query,Could you update me on the most recent events and occurrences around town?
news_query,Can you tell me about the current situation at the Capitol building?
news_query,Is there any activity or events happening presently at the Capitol?
news_query,What is currently the situation at the political center of the nation?
news_query,What is currently happening at the seat of government?
news_query,Can you provide information about the current situation at the Capitol building?
news_query,Could you update me on the events unfolding in the Houses of Congress?
news_query,What are the latest happenings this morning?
news_query,Is there anything noteworthy to report today?
news_query,Have any important events taken place in the morning hours?
news_query,What are the latest happenings this morning?
news_query,Can you provide an update on today's events so far?
news_query,What's the buzz around town today?
news_query,Can you give me an update on the current status of Trump's travel ban?
news_query,What is the most recent development regarding Trump's restriction on travel?
news_query,Could you inform me of any fresh information related to the implementation of Trump's travel restrictions?
news_query,Can you update me on the current status of Trump's immigration restriction?
news_query,
news_query,What's new with regards to Trump's travel ban policy?
news_query,
news_query,Is there any recent development concerning Trump's order on travel limitations?
news_query,Is there any fresh content available on Facebook?
news_query,Are there any recent updates or developments on Facebook?
news_query,Has anything changed recently on Facebook that I should be aware of?
news_query,Has there been any recent development on Facebook?
news_query,Is there anything unique happening on Facebook lately?
news_query,Have there been any changes or updates in the world of Facebook?
audio_volume_down,"Can you reduce the level of the sound, please?"
audio_volume_down,Would you mind decreasing the volume a bit?
audio_volume_down,"Could you turn down the intensity of the audio, please?"
audio_volume_down,"Could you decrease the decibel level, please?"
audio_volume_down,"Can you bring down the sound, please?"
audio_volume_down,Would it be possible to make the audio less loud?
audio_volume_down,Reduce the loudness.
audio_volume_down,Diminish the intensity of the sound.
audio_volume_down,Turn down the auditory level.
audio_volume_down,Bring down the intensity of the sound.
audio_volume_down,Reduce the amplitude of the audio.
audio_volume_down,Diminish the loudness of the noise.
audio_volume_down,Kindly reduce the loudness.
audio_volume_down,It would be appreciated if you could turn down the sound level.
audio_volume_down,Can you make the audio more bearable to our ears?
audio_volume_down,"Kindly reduce the sound level, it's too high."
audio_volume_down,"Could you turn down the noise a bit, please?"
audio_volume_down,"The volume seems to be quite loud, could you decrease it?"
audio_volume_down,"""Reduce the speaker's audio level."""
audio_volume_down,"""Turn down the volume of the person speaking."""
audio_volume_down,"""Diminish the speaker's sound intensity."""
audio_volume_down,Adjust the sound output of the speaker to a more moderate level.
audio_volume_down,Diminish the loudness of the speaker's audio transmission.
audio_volume_down,Bring down the intensity of the speaker's voice projection.
audio_volume_down,Can you please reduce the sound intensity of the speakers?
audio_volume_down,Would it be possible for you to turn down the speaker's audio level?
audio_volume_down,Could you possibly decrease the volume emitting from the speakers?
audio_volume_down,Reduce the audio output of the speakers.
audio_volume_down,Turn down the sound on the speaker system.
audio_volume_down,Decrease the volume emanating from the loudspeakers.
audio_volume_down,Can you please tone down your voice a bit?
audio_volume_down,Would you mind speaking in a hushed manner?
audio_volume_down,Could you adjust the volume of your speech to a more subdued level?
audio_volume_down,Could you reduce the volume of your voice?
audio_volume_down,Can you modulate your vocal pitch to a lower frequency?
audio_volume_down,Would it be possible for you to tone down your speaking volume?
audio_volume_down,"Turn down the sound level, please."
audio_volume_down,I'd appreciate it if you could reduce the volume a bit.
audio_volume_down,Could you please minimize the audio intensity?
audio_volume_down,"Reduce the sound level, please."
audio_volume_down,Turn down the audio output.
audio_volume_down,"Diminish the loudness, if possible."
audio_volume_down,Diminish the intensity of media sound.
audio_volume_down,Reduce the decibel level of media output.
audio_volume_down,Dial back the amplitude of media audio.
audio_volume_down,"Reduce the volume of media, please"
audio_volume_down,Diminish the loudness of media
audio_volume_down,Tone down the volume of media
audio_volume_down,Turn down the sound by half.
audio_volume_down,Set the volume to half the current value.
audio_volume_down,Reduce the audio levels to half of their current level.
audio_volume_down,"Reduce the sound to fifty percent, please."
audio_volume_down,Adjust the volume level until it reaches halfway point.
audio_volume_down,Make the loudness equivalent to half of its current level.
audio_volume_down,Could you please modulate your voice volume down a notch?
audio_volume_down,I would appreciate it if you could adjust the pitch of your speech to a gentler level.
audio_volume_down,Can you kindly restrain the intensity of your vocalization?
audio_volume_down,"Can you speak in a gentler tone, please?"
audio_volume_down,Could you use a more subtle voice while talking?
audio_volume_down,I would appreciate it if you lowered the volume of your speech.
weather_query,"Has precipitation been happening lately in New Brighton, PA?"
weather_query,"Are the skies pouring down drops over New Brighton, PA?"
weather_query,"Is there any dampness that can be observed presently in New Brighton, PA?"
weather_query,"Are the skies pouring over New Brighton, PA?"
weather_query,"Is precipitation falling in New Brighton, PA?"
weather_query,"Is there rainwater descending upon New Brighton, PA?"
weather_query,Are there any chances of precipitation occurring today?
weather_query,Is it anticipated that the atmosphere will pour down its contents today?
weather_query,Will we need to bring our umbrellas with us due to predicted rain?
weather_query,Is precipitation expected later in the day?
weather_query,Will the skies release any water droplets today?
weather_query,Are we anticipating any wetness from the skies today?
weather_query,Would it be necessary for me to wear my sunglasses at present?
weather_query,Are sunshades required for today's brightness level?
weather_query,Should I put on my shades for today's sunny conditions?
weather_query,Do I need to bring my sunglasses with me today?
weather_query,Is it necessary for me to wear my shades today?
weather_query,Would I benefit from carrying my sunnies around the whole day?
weather_query,Are we expecting any snowfall during the current week?
weather_query,Is there a possibility of seeing some snowflakes in the upcoming days?
weather_query,Will the precipitation include frozen white flakes at any point this week?
weather_query,Will there be any snowfall in the upcoming week?
weather_query,Are we expecting any frosty precipitation during this week?
weather_query,Is it likely to experience snowy conditions throughout the current week?
weather_query,Can you give me an update on what to expect outside tomorrow?
weather_query,Could you inform me of the predicted conditions for tomorrow's outdoor environment?
weather_query,Is there a way for me to find out about the atmospheric circumstances that are anticipated for tomorrow?
weather_query,Can you inform me about tomorrow's atmospheric conditions?
weather_query,Could you please give me an update on the outlook for tomorrow?
weather_query,Is there any way I can find out what to expect from tomorrow's elements?
weather_query,What will be the atmospheric conditions of Barcelona after two days?
weather_query,Can you inform me about the forecasts in Barcelona a couple of days from today?
weather_query,Could you let me know what kind of climate we can expect to experience in two days' time in Barcelona?
weather_query,What will be the atmospheric conditions in Barcelona after two days?
weather_query,Can you provide an update on what's expected for Barcelona's sky after 48 hours?
weather_query,How would you describe the climate in Barcelona in two days' time?
weather_query,"Should it rain, then I won't proceed to work."
weather_query,"Assuming precipitation occurs, I wouldn't attend to my job."
weather_query,"In the event of rainfall, I'll refrain from going to work."
weather_query,"In case of rainfall, I won't be able to get to work."
weather_query,"If rain occurs, I won't make it to my place of employment."
weather_query,"Provided that there is precipitation, I won't attend my job."
weather_query,Is it advisable to carry an umbrella outside?
weather_query,Would it be a wise decision to bring along an umbrella?
weather_query,Is it necessary for me to have an umbrella with me?
weather_query,Would it be wise to bring along a rain shield?
weather_query,Do I need a canopy for my travels?
weather_query,Is it necessary to carry a waterproof cover with me?
weather_query,Can you give me an idea of what to expect on Monday?
weather_query,Could you inform me about the atmospheric conditions for the start of next week?
weather_query,What might be the climatic condition forecasted for the beginning of the workweek?
weather_query,Can you give me information about the atmospheric conditions that are anticipated to occur this upcoming Monday?
weather_query,I'm curious to know what kind of meteorological changes are expected to happen on the first day of the business week. Can you assist me with that?
