intent,text
cooking_recipe,Can you provide me with the instructions to make cookies?
cooking_recipe,"I'd like to learn how to bake cookies, could you show me the recipe?"
cooking_recipe,May I have the steps to create a batch of cookies?
cooking_recipe,Can you provide me with the instructions on how to make cookies?
cooking_recipe,What are the steps to create a cookie recipe?
cooking_recipe,May I see a guide on how to prepare cookies?
cooking_recipe,What is the ideal temperature for baking cookies?
cooking_recipe,
cooking_recipe,What temperature should I set my oven for when baking cookies?
cooking_recipe,
cooking_recipe,"When making cookies, what temperature should I bake them at?"
cooking_recipe,What's the ideal temperature to bake cookies?
cooking_recipe,"When baking cookies, what temperature should I set my oven to?"
cooking_recipe,Is there a specific temperature that works best for baking cookies?
cooking_recipe,Can you provide me with a recipe for making cookies?
cooking_recipe,"I would like to learn how to prepare cookies, can you show me a recipe?"
cooking_recipe,Do you happen to have a guide on making cookies?
cooking_recipe,Can you provide me with a recipe for baking cookies?
cooking_recipe,"I'm looking for directions to make homemade cookies, can you help me out?"
cooking_recipe,Could you share with me a guide on creating delicious cookies?
cooking_recipe,What is the ideal frying temperature for cooking a whole turkey?
cooking_recipe,How can I determine the appropriate temperature for frying an entire turkey?
cooking_recipe,Is there a specific temperature range that's suitable for deep-frying a whole turkey?
cooking_recipe,What is the right temperature to fry a whole turkey?
cooking_recipe,How can I determine the ideal frying temperature for a whole turkey?
cooking_recipe,Is there a specific temperature that must be maintained while frying a whole turkey?
cooking_recipe,"""What constitutes the perfect meatball recipe?"""
cooking_recipe,"""What is the ultimate way to prepare meatballs?"""
cooking_recipe,"""How do you make the most delicious meatballs?"""
cooking_recipe,What recipe makes the most delicious meatballs?
cooking_recipe,Can you suggest a recipe that produces mouth-watering meatballs?
cooking_recipe,How can I cook meatballs in a way that will make them taste the best?
cooking_recipe,What temperature is ideal for roasting potatoes in the oven?
cooking_recipe,"When roasting potatoes, what temperature should be set on the oven?"
cooking_recipe,What is the optimal oven temperature for baking potatoes?
cooking_recipe,What temperature setting is ideal for oven-roasted potatoes?
cooking_recipe,"When roasting potatoes, what temperature should the oven be set at for optimal results?"
cooking_recipe,"In order to achieve perfectly roasted potatoes, what is the most suitable temperature for the oven to be programmed at?"
cooking_recipe,Search for recipes on how to make a four-cheese omelette.
cooking_recipe,Browse for instructions on preparing a four-cheese omelette.
cooking_recipe,Seek out guides on creating a four-cheese omelette.
cooking_recipe,Search for instructions on how to make a four-cheese omelette.
cooking_recipe,Seek out methods for creating a four-cheese omelette.
cooking_recipe,Find recipes that demonstrate the preparation of a four-cheese omelette.
cooking_recipe,Can the robot provide me with a list of ingredients for welsh rarebit?
cooking_recipe,"I need the recipe for welsh rarebit, can the robot list down the ingredients for me?"
cooking_recipe,"Robot, could you please give me a rundown of the necessary ingredients to make welsh rarebit?"
cooking_recipe,"Can you provide me with a compilation of ingredients for welsh rarebit, dear robot?"
cooking_recipe,"Dear bot, could you furnish me with a rundown of the essential components to make welsh rarebit?"
cooking_recipe,"Would it be possible, dear robotic friend, to assemble a list of the necessary ingredients required to concoct welsh rarebit?"
cooking_recipe,"Creating a paraphrase: ""The meal is what I aim to cook."""
cooking_recipe,"Creating another paraphrase: ""Preparing that specific dish is what I desire to do."""
cooking_recipe,"Creating a third paraphrase: ""Cooking that particular cuisine is my intention."""
cooking_recipe,I desire to prepare that dish.
cooking_recipe,My intention is to make that meal.
cooking_recipe,"The food item, I wish to cook it."
cooking_recipe,What are some ways to prepare a meal?
cooking_recipe,Can you provide me with instructions on cooking a meal?
cooking_recipe,What steps should I take when making a cooked dish?
cooking_recipe,What are the ways to prepare a dish?
cooking_recipe,What techniques can be utilized for cooking food?
cooking_recipe,How can one go about making a meal?
datetime_query,Can you inform me of the present time?
datetime_query,"What is the current time, if I may ask?"
datetime_query,Could you share with me what time it currently is?
datetime_query,Can you inform me about the present moment?
datetime_query,Could you share with me the time that is currently displayed on your device?
datetime_query,May I ask for the current timestamp?
datetime_query,What is the current time in Chicago?
datetime_query,Could you tell me the hour in Chicago?
datetime_query,Do you know what time it is in Chicago right now?
datetime_query,What is the time in Chicago?
datetime_query,Could you provide me with the current time in Chicago?
datetime_query,"I need to know what time it is in Chicago, can you tell me?"
datetime_query,"""How do you define time?"""
datetime_query,"""Can you explain the concept of time?"""
datetime_query,"""What does the term 'time' mean to you?"""
datetime_query,"""What is the definition of time?"""
datetime_query,"""How would you describe the concept of time?"""
datetime_query,"""Can you explain what time means?"""
datetime_query,What is the current time in Chicago?
datetime_query,Can you tell me what time it is in Chicago?
datetime_query,I wonder if you have any idea about the time in Chicago right now?
datetime_query,What's the current time in Chicago?
datetime_query,Could you tell me what the present time is in Chicago?
datetime_query,"I'm curious about the time right now in Chicago, can you inform me?"
datetime_query,What is the current time in Germany?
datetime_query,Could you please tell me the present time in Germany?
datetime_query,"I would like to know what time it currently is in Germany, can you show me?"
datetime_query,Could you provide me with the current time in Germany?
datetime_query,"I need to know what the time is right now in Germany, can you show me?"
datetime_query,Can you tell me the present time in Germany?
datetime_query,Look up the current time and time zone for your locality.
datetime_query,Search for the present local time and corresponding time zone.
datetime_query,Find out the time and time zone that are presently applicable in your region.
datetime_query,Investigate and discover the present time and time zone in your local area.
datetime_query,Explore to locate the existing local time and its respective time zone.
datetime_query,Hunt down the current local time and determine its corresponding time zone.
datetime_query,What is the present time in New York City? 
datetime_query,Could you tell me the current time in NYC? 
datetime_query,Do you happen to know what hour it is in New York City at the moment?
datetime_query,What is the current time in New York City?
datetime_query,Could you tell me the present time in New York City?
datetime_query,Do you have any idea what the time is right now in New York City?
datetime_query,Can you tell me the present time in Ivory Coast?
datetime_query,What is the current time in Ivory Coast right now?
datetime_query,Could you let me know what time it is currently in Ivory Coast?
datetime_query,"""What is the present time in Ivory Coast?"""
datetime_query,"""Can you tell me what time it currently is in Ivory Coast?"""
datetime_query,"""Do you know the current local time in Ivory Coast?"""
datetime_query,"""How many hours ahead or behind is Dakar compared to this location?"""
datetime_query,"""What is the time discrepancy between here and Dakar?"""
datetime_query,"""Can you tell me how much of a time zone difference exists between Dakar and our current location?"""
datetime_query,"""How many hours ahead or behind is Dakar's time compared to here?"""
datetime_query,"""What is the time zone difference between our current location and Dakar?"""
datetime_query,"""Could you tell me the time offset between where we are now and Dakar?"""
datetime_query,When will Wednesday of next week take place?
datetime_query,Could you let me know the date for next Wednesday?
datetime_query,What day and date is coming up as next Wednesday?
datetime_query,When is next Wednesday's date?
datetime_query,Could you tell me what day it will be on the coming Wednesday?
datetime_query,What will the date be on next week's Wednesday?
audio_volume_up,"Increase the volume level, please."
audio_volume_up,"Can you raise the volume a little, please?"
audio_volume_up,Would you mind making the sound louder?
audio_volume_up,"Could you increase the sound level, please?"
audio_volume_up,I would appreciate it if you could raise the volume.
audio_volume_up,"Can you make the audio louder, please?"
audio_volume_up,Increase the volume of the sound.
audio_volume_up,Raise the audio level.
audio_volume_up,Enhance the auditory experience by amplifying the sound.
audio_volume_up,Increase the volume.
audio_volume_up,Enhance the audio level.
audio_volume_up,Amplify the sound.
audio_volume_up,Is it possible for you to increase the volume?
audio_volume_up,Would you mind turning up the volume?
audio_volume_up,Could you make the sound louder?
audio_volume_up,Could you increase the sound level?
audio_volume_up,Can you amplify the audio?
audio_volume_up,Would you mind raising the volume?
audio_volume_up,"""I require a large quantity."""
audio_volume_up,"""My need is for a substantial amount."""
audio_volume_up,"""A high volume is what I am seeking."""
audio_volume_up,I require a large quantity. 
audio_volume_up,My demand is for a significant amount of volume.
audio_volume_up,I am in need of a substantial volume.
audio_volume_up,Enhance the audio output of the left speaker by adding ten decibels.
audio_volume_up,Raise the volume level of the left speaker up to ten notches.
audio_volume_up,Amplify the sound coming from the left speaker by increasing it by ten units.
audio_volume_up,Raise the left speaker's volume by ten notches
audio_volume_up,Boost the volume of the leftward-facing speaker by 10
audio_volume_up,Enhance the sound levels of the speaker on the left side by ten units.
audio_volume_up,Kindly increase the volume to twenty-one.
audio_volume_up,
audio_volume_up,Could you make the volume louder up to twenty-one?
audio_volume_up,
audio_volume_up,Would you mind setting the volume to twenty-one?
audio_volume_up,"Can you increase the volume to twenty one, please?"
audio_volume_up,Would you mind adjusting the volume to twenty one?
audio_volume_up,"Could you raise the volume to twenty one, please?"
audio_volume_up,"Can you increase the volume to the maximum level, please?"
audio_volume_up,Kindly adjust the volume to the highest possible setting.
audio_volume_up,Would you mind turning up the sound to its loudest level?
audio_volume_up,Kindly set the volume to maximum level.
audio_volume_up,Can you increase the volume to the highest option?
audio_volume_up,It would be great if you could turn up the sound to the loudest setting.
audio_volume_up,"Can you increase the volume a bit louder, please?"
audio_volume_up,"May I request for a higher volume level, please?"
audio_volume_up,"Could you turn up the volume a little bit more, please?"
audio_volume_up,Can you please increase the volume to a higher level?
audio_volume_up,"May I request for a louder sound, please?"
audio_volume_up,Would it be possible to amplify the volume?
audio_volume_up,Your voice is not audible to me.
audio_volume_up,I am unable to perceive any sound coming from you.
audio_volume_up,It seems that I am having difficulties hearing what you are saying.
audio_volume_up,Your voice is not audible to me.
audio_volume_up,I am unable to catch your words.
audio_volume_up,Your message is unclear as I cannot perceive sound from you.
audio_volume_up,Could you kindly amplify the volume? 
audio_volume_up,"Would it be possible to boost the volume level, please?"
audio_volume_up,"Can you raise the volume, if feasible?"
audio_volume_up,"Can you turn up the volume, please?"
audio_volume_up,Would you mind adjusting the sound to be louder?
audio_volume_up,Could you kindly increase the volume for me?
news_query,Is there any update on the recent bombing incident in Sweden?
news_query,
news_query,Can you provide any information regarding any new developments related to the Sweden bombing?
news_query,
news_query,Has there been any progress or updates on the investigation into the Sweden bombing?
news_query,"""Is there any update regarding the Sweden bombing?"""
news_query,"""Has any new development surfaced in relation to the Sweden bombing?"""
news_query,"""Are there any recent developments that have come to light about the Sweden bombing?"""
news_query,What are the current news topics that are popular and widely discussed?
news_query,Which news subjects are currently generating a lot of interest and attention?
news_query,What are the trending news themes that are being talked about extensively in the media?
news_query,What are the current popular news subjects gaining attention?
news_query,Which news headlines are currently trending and receiving significant attention?
news_query,What are the latest newsworthy topics that have caught the public’s eye?
news_query,"""Could you tell me the latest updates on the local news?"""
news_query,"""What is the most recent piece of information about the local news?"""
news_query,"""Can you provide me with the up-to-date developments in the local news?"""
news_query,What is the latest update on the local news?
news_query,
news_query,Can you provide me with the most recent updates on the local news?
news_query,
news_query,Could you tell me what is happening in the local area at the moment?
news_query,Can you provide me with updates about Donald Trump?
news_query,May I inquire about the latest developments concerning Donald Trump?
news_query,Could you give me information regarding what is happening in relation to Donald Trump?
news_query,"""Could you provide me with updates regarding Donald Trump?"""
news_query,"""I'm interested in knowing about any recent developments involving Donald Trump, can you help?"""
news_query,"""Can you give me some information or updates on the current situation of Donald Trump?"""
news_query,Has the voting process for the budget concluded?
news_query,Did they conduct a vote on the budget yet?
news_query,Has there been a decision made regarding the budget through voting?
news_query,Has a decision been made regarding the budget vote?
news_query,Is the voting on the budget completed?
news_query,Has the budget gone through the voting process yet?
news_query,"""Can you provide me with the most recent updates about what's happening in our local community?"" "
news_query,"""I'm curious to hear any fresh news about current events going on within our city. Can you help enlighten me?"" "
news_query,"""Are there any newly reported occurrences or happenings that I should be aware of within our immediate area? Please update me."""
news_query,Can you provide me with the most recent updates about the city?
news_query,What is the most current news happening in the local area?
news_query,Could you inform me of any noteworthy events occurring in the city?
news_query,What is currently happening at the capitol? 
news_query,Could you provide me with an update on the events unfolding at the capitol? 
news_query,Do you have any information on the situation occurring at the capitol building?
news_query,What is happening currently at the capitol?
news_query,Can you inform me about the events taking place at the capitol?
news_query,Do you have any updates regarding the situation at the capitol?
news_query,What are the headlines this morning?
news_query,What is currently happening in the world today?
news_query,What events or developments have occurred since last night?
news_query,What are the latest updates this morning?
news_query,Could you share any current information for today?
news_query,Any breaking news to report for this morning?
news_query,Can you provide me with any updates regarding Trump's travel restrictions?
news_query,What is the current status of the travel ban implemented by Donald Trump?
news_query,Have there been any recent developments in relation to the travel ban enacted by President Trump?
news_query,What is the most recent news about Trump's travel ban?
news_query,Can you provide me with an update on Trump's travel ban?
news_query,Do you know the current status of Trump's travel ban?
news_query,"""Is there anything fresh or innovative happening on Facebook?"""
news_query,"""Have there been any recent updates or developments on Facebook worth noting?"""
news_query,"""What's the latest news or changes on Facebook?"""
news_query,Is there anything fresh happening on Facebook?
news_query,Has anything changed on Facebook lately?
news_query,Are there any recent updates or developments on Facebook?
audio_volume_down,"Can you decrease the volume, please?"
audio_volume_down,"Would you mind turning down the sound a bit, please?"
audio_volume_down,"Could you reduce the audio level, please?"
audio_volume_down,Could you decrease the volume a bit?
audio_volume_down,"Can you make the sound softer, please?"
audio_volume_down,Would you mind turning down the volume?
audio_volume_down,Lower the volume.
audio_volume_down,Turn down the volume.
audio_volume_down,Reduce the volume level.
audio_volume_down,Lower the sound level.
audio_volume_down,Reduce the amplitude.
audio_volume_down,Diminish the audio volume.
audio_volume_down,"Can you reduce the volume, please?"
audio_volume_down,"The noise is disturbing, can you turn down the volume?"
audio_volume_down,Could you kindly decrease the level of sound?
audio_volume_down,Can you turn down the sound a little?
audio_volume_down,"Is it possible to reduce the volume, please?"
audio_volume_down,Would you mind decreasing the audio level?
audio_volume_down,Reduce the volume of the speaker's voice.
audio_volume_down,Bring down the level of the speaker's audio output.
audio_volume_down,Decrease the intensity of the speaker's volume.
audio_volume_down,Reduce the volume at which the speaker is speaking.
audio_volume_down,Lower the speaker's sound level.
audio_volume_down,Decrease the speaker's volume setting.
audio_volume_down,Decrease the loudness of the speakers.
audio_volume_down,Turn down the volume of the speakers.
audio_volume_down,Reduce the audio level of the speakers.
audio_volume_down,Reduce the sound level of the speakers.
audio_volume_down,Decrease the volume coming from the speakers.
audio_volume_down,Turn down the audio output of the speakers.
audio_volume_down,Could you please lower your voice?
audio_volume_down,Can you speak more softly?
audio_volume_down,Would you mind reducing the volume of your speech?
audio_volume_down,Please tone down your voice.
audio_volume_down,Could you lower the volume of your speech?
audio_volume_down,Speaking softly would be appreciated.
audio_volume_down,Reduce the volume.
audio_volume_down,Turn down the volume.
audio_volume_down,Decrease the volume level.
audio_volume_down,Decrease the volume.
audio_volume_down,Turn down the volume.
audio_volume_down,Reduce the volume level.
audio_volume_down,Decrease the volume of media.
audio_volume_down,Lower the audio levels of multimedia.
audio_volume_down,Reduce the sound intensity of digital content.
audio_volume_down,Reduce the volume of media?
audio_volume_down,Lower the media's volume?
audio_volume_down,Bring down the volume of media?
audio_volume_down,Reduce the sound level to fifty percent.
audio_volume_down,Decrease the volume by half.
audio_volume_down,Cut the audio output in half.
audio_volume_down,Decrease the volume by half.
audio_volume_down,Bring down the volume by 50%.
audio_volume_down,Reduce the volume to half its current level.
audio_volume_down,Could you please lower your voice?
audio_volume_down,I would appreciate it if you spoke more softly.
audio_volume_down,Can you kindly speak in a quieter tone?
audio_volume_down,Kindly lower your voice when speaking.
audio_volume_down,Can you please speak more quietly?
audio_volume_down,It would be appreciated if you could reduce the volume of your speaking.
weather_query,"Is precipitation falling in New Brighton, Pennsylvania?"
weather_query,"Does the area of New Brighton, PA have a rainfall today?"
weather_query,"Can you confirm if it's currently raining in New Brighton, PA?"
weather_query,"Is New Brighton, PA experiencing rainfall?"
weather_query,"Does it currently rain in New Brighton, PA?"
weather_query,"Can you confirm whether or not it is raining in New Brighton, PA?"
weather_query,Will there be rain today as expected?
weather_query,Is the forecast predicting rainfall for today?
weather_query,Are we anticipating precipitation on this day?
weather_query,Is today forecasted to rain?
weather_query,Will there be precipitation expected for today?
weather_query,Does the weather report predict rainfall today?
weather_query,"""Do I require the usage of my shades for today?"""
weather_query,"""Is it recommended for me to wear sunglasses as part of my outdoor gear today?"""
weather_query,"""Will it be necessary for me to bring along my sun glasses when stepping outside today?"""
weather_query,Will it be necessary for me to wear my sunglasses today?
weather_query,Do I have to bring my sunglasses with me today?
weather_query,Is it sunny enough outside that wearing sunglasses is advisable?
weather_query,Will there be snow this week as predicted?
weather_query,Is the forecast indicating snowfall during this week?
weather_query,Can we expect snow to occur sometime within this week?
weather_query,Will there be snowfall this week?
weather_query,Is there a possibility of snow this week?
weather_query,Are we expecting any snow during the upcoming days?
weather_query,Could you inform me about the weather forecast for tomorrow?
weather_query,Please give me an update on what to expect weather-wise for tomorrow.
weather_query,Can you provide me with information regarding the weather conditions anticipated for tomorrow?
weather_query,Can you inform me about the forecast for tomorrow?
weather_query,Please update me on the anticipated weather conditions for tomorrow.
weather_query,I would appreciate it if you could let me know what the weather will be like tomorrow.
weather_query,"""Inform me about the Barcelona weather forecast after 48 hours."""
weather_query,"""What will be the atmospheric condition in Barcelona two days ahead?"""
weather_query,"""Can you provide me with an update on the climate of Barcelona in two days time?"""
weather_query,Can you provide me with a forecast of the weather in Barcelona for two days from now?
weather_query,What will be the weather conditions in Barcelona two days later?
weather_query,Could you inform me about the climatic situation that's expected in Barcelona after 48 hours?
weather_query,I won't go to work if it's raining outside.
weather_query,"Provided that it's rainy, I will refrain from going to my place of employment."
weather_query,"If there is precipitation, then I have no intention of attending my job."
weather_query,"Unless there's no rain, I won't leave for work."
weather_query,"Provided that it is not raining, I can consider attending my job."
weather_query,"In case precipitation occurs, I'll refrain from going to my workplace."
weather_query,Is it necessary for me to carry an umbrella?
weather_query,Would it be wise to bring along an umbrella?
weather_query,Do I need to take an umbrella with me?
weather_query,Is it advisable to carry an umbrella?
weather_query,Does it make sense to bring along an umbrella?
weather_query,Would it be wise to take an umbrella with me?
weather_query,Kindly display the weather forecast for Monday.
weather_query,Can you indicate what the weather will be like on Monday?
weather_query,"I would like to see the weather conditions expected for Monday, please."
weather_query,Can you display the forecast for Monday's weather?
weather_query,"I would like to see the weather conditions for this coming Monday, can you assist me?"
weather_query,Could you kindly present the predicted weather pattern for Monday?
weather_query,Is it important for me to prepare for shoveling snow to leave my house?
weather_query,Do I need to make arrangements to clear the path out of my residence by shoveling?
weather_query,Would it be advantageous for me to devise a plan to shovel my way out of the home?
weather_query,Is it necessary for me to create a plan for shoveling snow in order to leave my house?
weather_query,Do I need to prepare myself to shovel out of my house?
weather_query,Am I required to come up with a strategy for clearing a path from my house using a shovel?
qa_currency,How does the value of a calone compare to that of a US dollar?
qa_currency,"In terms of worth, how does a calone measure up against a US dollar?"
qa_currency,What is the relative value of a calone in comparison to a US dollar?
qa_currency,"""How does the value of calone compare with that of a US dollar?"""
qa_currency,"""In terms of worth, how does calone measure up to the US dollar?"""
qa_currency,"""Compared to the US dollar, what is the value of a calone?"""
qa_currency,What is the value of five hundred pesos?
qa_currency,How much does five hundred pesos translate to?
qa_currency,Can you tell me the worth of five hundred pesos?
qa_currency,What is the value of five hundred pesos?
