intent,text
qa_currency,How much does five hundred pesos amount to?
qa_currency,What is the worth of five hundred pesos?
qa_currency,Could you tell me the current conversion rate between GBP and USD?
qa_currency,What is the present exchange value of pound sterling in relation to the US dollar?
qa_currency,Can you provide information on how much a pound sterling would be worth in US dollars?
qa_currency,Can you provide me with the current exchange rate between pound sterling and the US dollar?
qa_currency,What is the prevailing currency conversion rate between the British pound and the American dollar?
qa_currency,Could you tell me the present-day exchange rate for converting pound sterling into US dollars?
qa_currency,"""What is the equivalent amount in pounds for a certain number of dollars?"""
qa_currency,"""How much would it cost in pounds to purchase an item that costs a specific amount in dollars?"""
qa_currency,"""Can you provide me with the conversion rate from dollars to pounds?"""
qa_currency,"""Translate US dollars into British pounds."" "
qa_currency,"""Transform American currency to UK sterling."" "
qa_currency,"""Express USD in GBP."""
qa_currency,"""How does the value of lera compare to that of dollar?"" "
qa_currency,"""In comparison to the dollar, what is the worth of lera?"" "
qa_currency,"""What is the exchange rate between lera and dollar?"""
qa_currency,How does the value of lera compare to that of dollar?
qa_currency,"In comparison to the dollar, what's the worth of lera?"
qa_currency,What's the exchange rate between lera and dollar?
qa_currency,Can you tell me the current exchange rate between USD and INR?
qa_currency,
qa_currency,What is the prevailing USD to INR exchange rate right now?
qa_currency,
qa_currency,Do you know how much one US dollar converts to in Indian rupees at the moment?
qa_currency,"""Can you tell me the current conversion rate of USD to INR?"""
qa_currency,"""What is the ratio between USD and INR in the present scenario?"""
qa_currency,"""How much Indian rupee will I receive if I exchange a US dollar right now?"""
qa_currency,"""What form of money is used in Egypt?"""
qa_currency,"""In Egypt, what type of currency do they use?"""
qa_currency,"""Could you tell me the official monetary unit of Egypt?"""
qa_currency,What denomination of money is used in Egypt?
qa_currency,Can you tell me the unit of currency in Egypt?
qa_currency,"The monetary system in Egypt, what does it consist of?"
qa_currency,Can you provide me with the current yen exchange rate?
qa_currency,"I would like to know what the current yen exchange rate is, could you tell me?"
qa_currency,Do you have information on the yen exchange rate that you could share with me?
qa_currency,What is the current yen exchange rate?
qa_currency,Could you provide me with information on the yen's exchange rate?
qa_currency,"I am wondering about the present exchange rate for the yen, could you tell me?"
qa_currency,"""In what currency are transactions conducted in England?"""
qa_currency,"""Which monetary unit is employed for transactions in England?"""
qa_currency,"""What type of money is utilized in trade within England?"""
qa_currency,What is the official monetary unit in use in England?
qa_currency,Which currency is employed by England for transactions and trade?
qa_currency,In what type of currency does England conduct its financial operations?
qa_currency,What is the current exchange rate of US dollar to Japanese yen?
qa_currency,Can you provide me with the conversion rate for United States dollar and Japanese yen?
qa_currency,How many Japanese yen can I get in exchange for a United States dollar today?
qa_currency,Can you provide me with the current exchange rate for US dollars and Japanese yen?
qa_currency,What is the present conversion rate between American dollars and Japanese yen?
qa_currency,Could you tell me how much one US dollar is worth in Japanese yen right now?
play_music,Can you please play the soundtrack of Titanic movie?
play_music,"I would like to listen to the music from Titanic film, could you put it up?"
play_music,Is it possible for you to queue up the songs that were played in the movie Titanic?
play_music,Can you please stream the soundtrack of the movie Titanic?
play_music,"I'm in the mood for the music from Titanic, can you put it on?"
play_music,Could you play the songs that were featured in Titanic?
play_music,Perform the music piece that is commonly associated with the name Titanic.
play_music,Can you play the iconic theme song from the movie Titanic?
play_music,I would like to hear the melody famously known as the soundtrack of Titanic; could you perform it?
play_music,Can you please play the theme song from Titanic?
play_music,"I would like to hear the main soundtrack of Titanic, can you play it for me?"
play_music,Could you put on the title track from the movie Titanic?
play_music,"As long as you play a song by Cat Stevens, my happiness will be assured."
play_music,My contentment is guaranteed if you can put on any track from Cat Stevens' discography.
play_music,All it takes for me to feel pleased is for you to choose a song from the collection of works by Cat Stevens and play it.
play_music,"If you put on any music by Cat Stevens, it will make me happy."
play_music,Playing a Cat Stevens song would bring me joy.
play_music,I would be content if you were to cue up a track from Cat Stevens' discography.
play_music,Let's stream some tracks from the Beatles' music collection.
play_music,Could you put on some background tunes by the iconic band called the Beatles?
play_music,The time has come to jam out to some melodies produced by the legendary group known as the Beatles.
play_music,Can you put on some Beatles music?
play_music,I would like to listen to songs by the Beatles.
play_music,How about playing some tracks from the Beatles?
play_music,Commence the playlist from the beginning track. 
play_music,Initiate playback of the playlist starting at track number one. 
play_music,Begin the sequence of songs in the playlist with the first track.
play_music,Begin playlist with the first track.
play_music,Initiate playlist by playing the opening track.
play_music,Launch playlist starting with the initial song.
play_music,Generate some funky tunes.
play_music,Produce vibrant funk melodies.
play_music,Create upbeat tracks with a funky vibe.
play_music,Perform funk tunes.
play_music,Produce funky melodies.
play_music,play groovy rhythm and blues.
play_music,Could you please stream the latest playlist of Bob Dylan's music?
play_music,"I would like to listen to the most recently curated playlist of Bob Dylan's songs, can you make that happen?"
play_music,Can you play the most up-to-date and newest collection of Bob Dylan's music available in your database or streaming service?
play_music,Can you let me listen to the latest Bob Dylan playlist?
play_music,Is it possible to play the most recent collection of Bob Dylan's music?
play_music,Could you kindly put on the newest compilation of songs by Bob Dylan?
play_music,"Can you stream the song ""Let Me Love You"" by Ariana Grande?"
play_music,"Is it possible for you to play ""Let Me Love You"" sung by Ariana Grande?"
play_music,"Would you mind putting on the track ""Let Me Love You"", performed by Ariana Grande?"
play_music,"Could you put on the song ""Let Me Love You"" by Ariana Grande?"
play_music,"Is it possible for you to play Ariana Grande's ""Let Me Love You""?"
play_music,"Can you please play the track ""Let Me Love You"" performed by Ariana Grande?"
play_music,Kindly put on the songs from my playlist.
play_music,Would you mind playing the music that's in my playlist?
play_music,Can you play the tracks listed in my playlist?
play_music,Could you please stream the songs from my playlist?
play_music,Kindly play the music listed on my playlist.
play_music,I request that you choose songs from my prepared playlist to listen to.
play_music,"What is the meaning of ""play artist""?"
play_music,"How can you define ""play artist""?"
play_music,"What does the term ""play artist"" imply?"
play_music,"What does the term ""play artist"" mean?"
play_music,"Can you provide a definition for ""play artist""?"
play_music,"How would you describe the concept of ""play artist""?"
transport_traffic,What is considered an appropriate duration for a drive to work?
transport_traffic,How much time is considered reasonable to commute to work?
transport_traffic,What amount of time is considered acceptable for a daily work commute?
transport_traffic,What is the recommended duration of commuting to work?
transport_traffic,How much time should one allocate for their daily drive to work?
transport_traffic,Is there a specific timeframe that one must consider when driving to work?
transport_traffic,Are there any disruptions in traffic?
transport_traffic,Is traffic moving freely or are there issues causing delays?
transport_traffic,Are there any obstructions impeding traffic flow?
transport_traffic,Are there any obstructions in the traffic flow?
transport_traffic,Has there been any disruption to vehicular movement on the roads?
transport_traffic,Are there any traffic disruptions that should be taken into account?
transport_traffic,Can you provide an update on the current traffic conditions of the one hundred and one highway?
transport_traffic,How heavy is the traffic flow on the one hundred and one road at the moment?
transport_traffic,Do you happen to know if there are any congestion issues on the one hundred and one freeway?
transport_traffic,Can you give me an update about the traffic conditions on Highway 101?
transport_traffic,How's the flow of vehicles on the one-o-one?
transport_traffic,Is there heavy congestion currently present on the 101 freeway?
transport_traffic,"""What is the level of traffic congestion on my route to work?"""
transport_traffic,"""Can you tell me how much traffic there is on the road I take to get to work?"""
transport_traffic,"""Is the traffic heavy or light on my commute to work?"""
transport_traffic,"""To what extent is the traffic on my commute congested?"""
transport_traffic,"""What level of congestion can I expect on my route to work?"""
transport_traffic,"""How much traffic will there be during my daily commute to work?"""
transport_traffic,What's the current condition of the roads?
transport_traffic,Are the roads in good shape at present?
transport_traffic,How do the roads appear as of now?
transport_traffic,What is the current condition of the roads?
transport_traffic,Can you give me an update on the road conditions at this moment?
transport_traffic,How do the routes look like presently?
transport_traffic,What was the traffic like at this moment?
transport_traffic,Can you describe the current state of traffic?
transport_traffic,How would you evaluate the present traffic conditions?
transport_traffic,"""What was the traffic like at this moment?"""
transport_traffic,"""How heavy was the traffic currently?"""
transport_traffic,"""In what state was the traffic presently?"""
transport_traffic,Can you provide me with an update on the traffic situation?
transport_traffic,What is the current state of traffic conditions?
transport_traffic,Would you be able to share any information regarding the present traffic status?
transport_traffic,Can you provide me with the current status of traffic?
transport_traffic,Could you give me an update on the present traffic situation?
transport_traffic,What is the current state of traffic?
transport_traffic,"""Can you tell me the current status of traffic?"" "
transport_traffic,"""What is the present situation of the traffic flow?"" "
transport_traffic,"""How heavy or light is the traffic at the moment?"""
transport_traffic,"""What is the current state of traffic?"""
transport_traffic,"""How heavy is the traffic at the moment?"""
transport_traffic,"""Is there a lot of traffic currently?"""
transport_traffic,"""Is there a smooth flow of traffic on the way to work?"""
transport_traffic,"""Is morning commute traffic congestion-free today?"""
transport_traffic,"""Is the journey to work experiencing any traffic obstructions?"""
transport_traffic,"""Is the route to work free from traffic?"""
transport_traffic,"""Is the commute to work smooth in terms of traffic?"""
transport_traffic,"""Is it congested on your way to work?"""
transport_traffic,"""What is the status of my daily transportation?"""
transport_traffic,"""How's the journey from home to work treating me?"""
transport_traffic,"""In what manner do I traverse from my residence to workplace?"""
transport_traffic,What is the quality of my daily commute?
transport_traffic,How would you describe my journey to work?
transport_traffic,Can you evaluate how convenient my everyday transportation is?
music_query,Can you locate the song that is currently playing?
music_query,Is there any way you could help me find the song that's currently on?
music_query,Could you provide me with information about the track that is presently being played?
music_query,Can you locate the song that is presently being played?
music_query,Please help me discover the name of the tune that is playing at the moment.
music_query,Would you be able to identify the musical track currently on air?
music_query,Which type of music do I predominantly listen to?
music_query,What is the genre of music that I listen to most frequently?
music_query,What musical category do I prefer over others when listening to music?
music_query,Which type of music do I listen to the most?
music_query,What is my preferred genre of music?
music_query,In which category of music do I spend most of my listening time?
music_query,Can you please tell me the artist of this song?
music_query,"I'm curious, whose name should I look for as the singer of this track?"
music_query,Do you happen to know who performed this particular musical piece?
music_query,What is the name of the artist who performed that song?
music_query,Can you tell me the musician or singer responsible for that particular song?
music_query,Who's the person behind the creation and performance of that melody?
music_query,Can you forward the lyrics of this song to my email inbox?
music_query,I would appreciate it if you could send me the words to this tune via electronic mail.
music_query,Kindly email me the lyrical content of this melody.
music_query,Can you send me the lyrics of this song via email?
music_query,Would it be possible to receive the lyrics of this track through email?
music_query,May I request for the song's lyrics to be emailed to me?
music_query,Can you provide me with details about the currently playing song?
music_query,What can you tell me about the music that's currently being played?
music_query,Could you furnish me with some knowledge regarding the song that is presently being played?
music_query,Can you provide me with details about the currently playing song?
music_query,I would like to know more about the music that is being played. Could you help me with it?
music_query,What can you tell me about the current track that's on?
music_query,Can you inform me of my musical preferences?
music_query,Could you reveal my favorite music genres?
music_query,What are the types of music that I tend to enjoy?
music_query,Can you inform me of my music preferences?
music_query,What kind of music do I prefer?
music_query,Could you tell me which genres of music I tend to enjoy?
music_query,Identify the vocalist
music_query,Can you tell me who the performer is?
music_query,Who is the person singing?
music_query,Identify the vocalist.
music_query,Provide the name of the person who sings.
music_query,What is the singer's name?
music_query,In which year was this song released?
music_query,When did this song first hit the music scene?
music_query,What is the release date of this particular track?
music_query,When was this song released?
music_query,In what year did this song make its debut?
music_query,What is the release date of this musical composition?
music_query,Can you help me locate the tune that's currently being played?
music_query,Is it possible for you to assist me in tracking down the song that is presently on air?
music_query,Could you aid me in discovering the name of the music that's playing at this moment?
music_query,Can you identify the music that is currently being played?
music_query,What's the name of the song that's currently on air?
music_query,Could you assist me in discovering the track currently being broadcast?
music_query,"""Could you provide me with the present track details?"""
music_query,"""What's the current status of the track information?"""
music_query,"""Can you update me on the track particulars at this moment?"""
music_query,What is the current status of track information?
music_query,Can you provide me with an update on the track information right now?
music_query,Do you know what the latest track information is?
